url,industry,title,keywords,description
csai.cn,网络科技,希财网,百度关键词 | 个人征信查询 | 房贷利率2023最新利率 | 征信查询 | gbp是什么货币 | 微粒贷开通 | 360关键词 | 信用卡逾期 | 期货开户 | 华夏银行信用卡客服电话95577 | bbd | 通达信选股器,"希财网是专业的投融资及理财产品导购平台,网站汇聚了国内权威的p2p网贷产品、个人贷款、信用卡及众筹等投资理财产品,是为投资者提供搜索、对比及导购的理财产品超市。"
itmop.com,网络科技,IT猫扑网,百度关键词 | it猫扑网 | 斗鱼直播伴侣 | bud | 智远一户通 | 爱剪辑破解版 | 360关键词 | it猫扑网 | 开罗游戏 | 智慧中小学app下载 | fd | 哥布林弹球,"IT猫扑网（www.itmop.com）提供破解软件,操作系统,绿色软件,手机软件,认证视频教程题库和网络相关技术文章等主流互联网资源下载,思科华为网络安全认证交流社区."
www.beijing.gov.cn,政府组织,北京市政务门户网站,百度关键词 | 首都之窗 | 北京市政府 | 重阳节 | 北京市人民政府 | 北京居住证 | 360关键词 | 首都之窗 | 北京市政府 | 北京市人民政府 | 北京市 | 北京居住证,首都之窗-北京市政务门户网站
xiazaiba.com,网络科技,下载吧,百度关键词 | 链得得 | 永中优云 | 下载吧 | 开心斗地主 | 竞彩篮球app | 360关键词 | knock | 下载吧 | 联想模拟器 | 电视家4.0永久免费版 | 华为云会议,"绿色下载吧（www.xiazaiba.com）是免费软件下载网站,以绿色软件,浏览器,单机游戏,手机软件,杀毒软件,单机游戏下载为主,两亿用户的选择,没有诱导广告的单机游戏软件下载网站!"
scs.gov.cn,政府组织,国家公务员局,百度关键词 | 国家公务员局 | 国家公务员局官网入口 | 国考 | 国家公务员 | 公务员考试 | 360关键词 | 国家公务员局 | 国家公务员局官网入口 | 国考 | 公务员 | 国家公务员,国家公务员局网站是宣传国家公务员管理工作的窗口、服务公众和广大公务员的桥梁，以及与社会各界沟通交流的平台。
,网络科技,华为手机官网,百度关键词 | 华为手机助手 | 华为手机 | 华为电脑管家 | 华为应用市场 | 阿尔法s华为版 | 360关键词 | 华为手机助手 | 华为手机 | 华为电脑管家 | 华为x5 | 华为笔记本,华为手机官网。
51sole.com,购物网站,搜了网,百度关键词 | 搜了网 | 3c认证机构 | 51搜了网 | 铜牌尺寸 | 华荣防爆 | 360关键词 | 搜了网 | reach认证 | 包钢集团 | 极速数据恢复 | 大娱号虚拟演播室,"搜了网（www.51sole.com）专注于为企业提供全面的市场行情， 热点采购，加工批发市场，供求商机，提单交易，黄金商铺，广告服务，发布引擎，网上推广等服务，是企业寻求网络贸易和网上推广的首选行业门户,聪明的老板上搜了网！"
duote.com,网络科技,2345软件大全,百度关键词 | 多特软件站 | 种子下载神器 | 潘粤明鬼吹灯五部顺序 | 多特网 | 超星尔雅登录入口 | 360关键词 | 97视频 | 籍贯怎么填写 | uuhf | 换IP软件免费 | 拔萝卜视频播放在线观看免费,"2345软件大全是国内更快的软件下载平台,国内更安全的软件下载中心。安全下载,从2345软件大全开始,2345软件大全只提供绿色、无毒、无插件、无木马的纯绿色软件下载站。"
downcc.com,网络科技,绿色资源网,百度关键词 | 像素火影 | 绿色资源网 | 下载游戏中心 | 盛大正版传奇手游 | 能修改任何游戏的修改器 | 360关键词 | pubg国际服手游下载 | 绿色资源网 | 绿色 | pvz | 方正小标宋简体字体免费下载,"绿色资源网提供汉化破解软件,硬件驱动下载,安卓手机app,单机游戏,安卓模拟器,修改器,游戏地图等,全心打造好的软件下载站."
uzzf.com,网络科技,东坡下载,百度关键词 | 小苹果影视 | photoshop 绿色版 | livestream | 茶杯狐cupfoxapp.官网 | 东坡下载 | 360关键词 | office2021 | tiktok国际版下载 | office2010激活工具 | office 2021 | office2016下载,"东坡下载（www.uzzf.com）包括应用软件，系统工具，网络软件，媒体工具，图文处理等十几个栏目，其绝快的更新速度以及齐全的资源库更为业界瞩目，引领国内下载站点的潮流,势将为用户打造一个实用免费的软件下载基地。"
51cto.com,网络科技,51CTO,百度关键词 | 51cto | 番号库 | 51cto学院 | getelementbyid | java api | 360关键词 | 51cto | tcp/ip协议 | autogpt | linux虚拟机 | 51cto学院,中国领先的IT技术网站51CTO是一个为CTO、IT技术经理、系统工程师、网络工程师、安全工程师、数据库工程师、网络管理员、开发工程师、项目管理人员等IT技术人员搭建的互动媒体平台，主要为IT技术人员提供新闻资讯、技术文档、BBS、博客、技术圈、培训课程、人才交流等专业服务。
crsky.com,网络科技,非凡软件站,百度关键词 | 上游棋牌 | 星力捕鱼 | 非凡软件站 | 非凡软件 | csol辅助 | 360关键词 | 暴风激活 | 万能图片转换器 | 义战龙城传奇 | 客户管理系统app | 哔哩下载姬,旗舰软件下载站，将免费软件、共享软件一网打尽!
downyi.com,网络科技,当易网 ,百度关键词 | obs下载 | sans模拟器 | 捕鱼下载 | 电视剧下载 | 当易网 | 360关键词 | ps绿色版 | 我爱迅雷 | 进击的巨人 下载 | 当易网 | 今日影视APP,当易网（www.downyi.com）是一个专业的IT服务类网站，为您提供软件、教程、源码、驱动免费下载，并提供IT方面的技术文章，包括故障、技巧、IT概念、游戏攻略、软件使用教程等内容，希望能成为您身边的IT技术专家。
ddooo.com,网络科技,多多软件站,百度关键词 | photoshop破解版 | 植物大战僵尸破解版 | 我的世界java版 | 桌面时钟软件下载 | 五音助手 | 360关键词 | 荐片 | 魔兽争霸3 | sketchup | 地平线5 | 思源黑体,"多多软件站提供好的绿色软件和热门单机游戏下载,本站全力打造一个安全,快速,绿色,无病毒的软件和游戏下载平台,每天新国内外新的绿色软件、单机游戏。"
jb51.net,网络科技,脚本之家,百度关键词 | 杨幂格斗家本家 | 脚本之家 | urldecode | gg修改器 | 怎么买狗狗币 | 360关键词 | xshell | navicat premium | system | loluu | 英雄联盟换肤大师,脚本之家（www.jb51.net）是国内专业的网站建设资源、脚本编程学习类网站，提供asp、php、asp.net、javascript、jquery、vbscript、dos批处理、网页制作、网络编程、网站建设等编程资料。
aizhan.com,网络科技,爱站网,百度关键词 | 爱站 | 爱站网 | 今天吧文学 | 四舍五入 | bnb89 | 360关键词 | 爱站 | 555 | 爱站网 | dnf公益服发布网 | 四虎,爱站（aizhan.com）成立于2009年，是一家专门针对中文站点提供服务的网站，属亿讯网络公司旗下。
onlinedown.net,网络科技,华军软件园,百度关键词 | easyconnect | 华军软件园 | 仿宋gb2312字体下载 | hbuilderx | fatkun | 360关键词 | word | cad | 图吧工具箱 | 快手极速版 | 快手下载,华军软件园提供国内外绿色免费软件下载中心，其中包含电脑软件、苹果应用、安卓应用等免费电脑/手机软件下载。想了解绿色免费软件下载更多内容，尽在华军软件下载！
m.163.com,网络科技,网易应用中心,百度关键词 | 网易 | 日本女优排名 | 女优大全 | 进洞 | 马保国实战视频 | 360关键词 | 南海归墟 | 吴梦梦 | 张贺玉 | melody marks | 中国生育率,"网易应用提供限时免费iPhone4游戏,iPhone4s游戏软件下载、苹果官网下载。包括iPhone手机游戏、iphone免费游戏、iphone工具、iphone铃声、iphone壁纸等应用下载。"
apple.com.cn,网络科技,苹果官网,百度关键词 | 苹果官网 | apple | itunes | mac | icloud | 360关键词 | 苹果官网 | apple | 苹果 | itunes | iphone,Apple 设计并创造了 iPod 和 iTunes、Mac 便携式和台式电脑、OS X 操作系统以及革命性的 iPhone 和 iPad。
downza.cn,网络科技,下载之家软件站,百度关键词 | 方正小标宋简体下载 | 惠普打印机驱动下载 | 下载之家 | ps绿色版 | 飞鸽客服工作台 | 360关键词 | excel表格 | 抖音极速版下载 | todesk远程控制 | visio | 固乔视频助手,"下载之家提供全网新安全的绿色软件、系统软件下载服务.所有软件均由下载之家严格检测,无病毒木马、诱导广告.安全下载全面的绿色软件就到下载之家."
csdn.net,网络科技,CSDN,百度关键词 | csdn | base64 | csdn网站 | element-ui | csdn官网 | 360关键词 | csdn | csdn网站 | k8s | latex | csdn官网,CSDN.NET - 全球大中文IT社区，为IT专业技术人员提供全面的信息传播和服务平台
pconline.com.cn,网络科技,太平洋电脑网,百度关键词 | 下划线 | 太平洋电脑网 | 网卡驱动 | 百度文库怎么免费下载文档 | 方正小标宋gbk | 360关键词 | 太平洋 | ar | 定时关机 | 截图快捷键 | 电脑截屏怎么截图,"太平洋电脑网是专业IT门户网站,为用户和经销商提供IT资讯和行情报价,涉及电脑,手机,数码产品,软件等."
mail.qq.com,网络科技,QQ邮箱,百度关键词 | qq邮箱 | qq邮箱登录 | qq邮箱官网登录入口 | 腾讯邮箱 | qqmail | 360关键词 | qq邮箱 | qq邮箱登录 | 腾讯邮箱 | qqmail | qqyouxiang,QQ邮箱(mail.qq.com)是腾讯公司2002年推出，向用户提供安全、稳定、快速、便捷电子邮件服务的邮箱产品，已为超过1亿的邮箱用户提供免费和增值邮箱服务。
360.cn,网络科技,360安全中心,百度关键词 | 360 | 360浏览器 | 360安全卫士 | 坦克世界 | 360压缩 | 360关键词 | 360 | 360浏览器 | 战舰世界 | 　下载 | 球球大作战 游戏,"360免费安全软件平台和智能硬件家居平台，免费安全软件平台为用户提供360安全卫士,360免费杀毒软件,360企业杀毒软件,360安全浏览器等安全软件,智能硬件家居平台包含360手机,智能摄像机,儿童智能手表,行车记录仪,智能路由器,超级充电器等智能硬件"
cathaypacific.com,交通旅游,国泰航空,百度关键词 | 国泰航空 | 国泰航空官网 | 国泰航空公司 | 航班时刻表 | cathaypacific | 360关键词 | 国泰航空 | 国泰航空官网 | 港龙航空 | 国泰航空公司 | 港龙航空官网,：国泰航空作为香港主要的航空公司，拥有专业的定票服务系统和各种机票特价活动的介绍。我们的网站为你提供各种票务服务，机票预定以及旅游咨询的提供。您可以通过网站查询相关的班机时刻表，行李，网上报到等服务的办理。。
wandoujia.com,网络科技,豌豆荚,百度关键词 | dytt | 下载 | 迅雷电影下载 | 　下载 | 网上打鱼游戏 | 360关键词 | 豌豆荚 | 狂野飙车9 | jj麻将 | 驾考宝典2023年下载 | 安装下载应用,"豌豆荚（www.wandoujia.com）能帮您便捷获取网络资源,管理手机内容,为您提供安卓软件下载,安卓应用下载,安卓游戏下载,您可以通过豌豆荚轻松备份通讯录,备份短信,备份应用.方便下载手机视频,手机铃声,手机壁纸，手机电子书。"
apple.com,行业企业,苹果官方网站,百度关键词 | iphone官网 | apple id | 苹果id | 苹果官网序列号查询 | appleid | 360关键词 | apple id | apple music | 苹果id | apple watch | macos,苹果公司（Apple Inc. ）是美国的一家高科技公司。由史蒂夫.乔布斯、斯蒂夫.沃兹尼亚克和罗.韦恩(Ron Wayne)等三人于1976年4月1日创立，并命名为美国苹果电脑公司（Apple Computer Inc. ）， 2007年1月9日更名为苹果公司，总部位于加利福尼亚州的库比蒂诺。
zol.com.cn,网络科技,中关村在线,百度关键词 | 中关村 | 中关村在线 | zol | 植物大战僵尸下载 | 中关村在线手机 | 360关键词 | 华为mate60pro | 中关村 | 三星s22 | 华为matex2官网价格 | 荣耀70,"中国领先的IT信息与商务门户, 包括新闻, 商城, 硬件, 下载, 游戏, 手机, 评测等40个大型频道，每天发布大量各类产品促销信息及文章专题，是IT行业的厂商, 经销商, IT产品, 解决方案的提供场所"
114piaowu.com,交通旅游,114票务网,百度关键词 | 12306客服电话人工 | 114票务网 | 福州火车站 | 合肥火车站 | 杭州汽车西站 | 360关键词 | 12308 | 香港政府 | 飞机票网上订票官网 | 高铁儿童票 | 票务查询系统,【114票务网】是国内领先12306火车票网上订票平台，提供火车票预订、余票、时刻、票价、车次等查询服务，支持全国火车站代售点12306自取票业务，12306网上订火车票官网是您火车出行的好帮手。
www.ceair.com,交通旅游,中国东方航空,百度关键词 | 东方航空 | 东航 | 东方航空官网 | 东航官网 | 东方航空公司官网 | 360关键词 | 东方航空 | 东航 | 东方航空官网 | 中国东方航空 | 东航官网,中国东方航空公司官方网站，提供国际国内机票、酒店、度假产品的查询和预订功能，东航服务热线95530。本站还提供网上值机、订座时座位预留、特殊餐食预订、航班动态查询和短信提醒等服务。东航是是国际化的航空公司，具有广泛覆盖国内各城市、日本、韩国、港澳台、东南亚、欧洲、美洲、澳洲等区域的航线网络。
,交通旅游,缤客,百度关键词 | booking | booking.com | 缤客 | 厦门悦华酒店 | www.booking.com | 360关键词 | booking | booking预订官网 | booking.com | www.booking.com | bookings,"Booking.com B.V.隶属于Priceline Group集团（纳斯达克上市公司：PCLN），拥有并经营Booking.com品牌，是全世界大的网上住宿预订公司。Booking.com的日均客房预订间夜数超过900,000。Booking.com网站以及APP吸引了来自世界各地的休闲旅游和商务差旅用户。"
kuaituiapp.cn,综合其他,快推云资源,百度关键词 | 速度与激情8网盘 | 催眠调教:hypnoslave | -- | -- | -- | 360关键词 | -- | -- | -- | -- | --,快推云资源是国内首屈一指的网盘资源搜索引擎，目前支持的网盘众多，可以进行百度网盘、阿里云盘、115网盘、蓝奏云盘、360云盘等主流网盘云资源的搜索，本站将会成为您工作和学习不可获取的工具，搜索的网盘资源类型众多，可以进行文档、影音、软件等等多重类型的文件搜索。
hnair.com,交通旅游,海南航空,百度关键词 | 海南航空 | 海航官网 | 海南航空官网 | 金鹏俱乐部 | 金鹏 | 360关键词 | 海南航空 | 海航 | 海航官网 | 海南航空官网 | 金鹏俱乐部,"海南航空官方网站, 国内、国际机票预订,在线办理乘机手续,24小时订票热线：950718"
qyer.com,交通旅游,穷游网,百度关键词 | 穷游网 | 穷游 | 穷游网官方网站 | 穷游锦囊 | 行程助手 | 360关键词 | 穷游网 | 穷游 | 澳洲签证 | 自由行 | 新西兰旅游攻略,【穷游网】鼓励和帮助中国旅行者以自己的视角和方式体验世界，为出国旅行者提供专业、实用、全面的出境游旅行指南和旅游攻略，是中国出境游旅行者们分享旅游目的地信息和游记攻略的平台。
,交通旅游,地球在线,百度关键词 | 地球在线 | 谷歌卫星地图 | 谷歌地球在线 | google地球在线 | google卫星地图 | 360关键词 | 卫星地图 | 谷歌地球 | 地图高清卫星地图 | google earth | 地球在线,地球在线（www.earthol.com）将世界各地的旅游景点、风景名胜、奇趣自然和名山大川等制作成可在线浏览的地图地标，使您可以足不出户就能游遍天南海北，您还可以把自己喜爱的地点地标轻松与他人分享与收藏，而且我们还在不断开发和创新更多实用好玩的功能。
ly.com,交通旅游,同程网,百度关键词 | 同程旅行 | 同程 | 同程网 | 同程旅游 | 企业差旅系统 | 360关键词 | 同程旅行 | 同程 | 同程网 | 同程旅游 | 同城旅游,同程网是中国领先的一站式旅游预订平台，提供20000多家特惠酒店、特价机票、景点门票、旅游度假、演出票务、租车预订服务；预订产品发表评价可获得10~100元现金券；专业服务、品质保障，让您的旅行更安心！
meet99.com,交通旅游,相约久久旅游网,百度关键词 | 卫星地图高清 | 东坝 | 兴业县 | 东岳庙 | 重庆卫星地图 | 360关键词 | 地图中国高清卫星地图 | 海王星 | 新西兰地图 | 印尼地图 | 可可托海攻略,"提供齐全的国内外旅游景点大全,您可以在这里找到关于旅游目的地详细的图文介绍,可信赖的游览路线,景区的卫星地图及出行提示,与大家分享自己的旅行心得感受。"
trains.ctrip.com,交通旅游,携程火车票官网,百度关键词 | 杭州到宁波 | 广州到海口 | 南昌到南京 | k188 | g222 | 360关键词 | 火车票查询 | 高铁票查询 | 列车时刻表 | 火车时刻表 | 高铁查询,【携程旅行网】提供火车票网上订票服务，以及火车时刻表，票价查询，携程火车票官网提供方便的高铁动车网上订票流程及余票查询。让您足不出户即可订购全国高铁动车票及高铁动车时刻表。
,交通旅游,深圳口岸中旅官网_,百度关键词 | 南山的部长们 | 性事 | 非礼勿视2 | 胭楼记 | 独酒男女 | 360关键词 | 黑袍纠察队 | 瑞克和莫蒂 | 最食人间烟火色 | 我是真的讨厌异地恋电影免费观看 | 欢迎光临电视剧在线观看,深圳永安国际旅行社专业为您提供：出境旅游、国内旅游、港澳旅游、签证办理和酒店机票预订等服务。永安国旅，永安旅行社，深圳旅行社排名第一，口碑好的深圳旅行社，深圳旅游公司。24小时咨询热线400-840-5566
airchina.com.cn,交通旅游,中国国际航空公司,百度关键词 | 国航 | 国航官网 | 中国国航 | 中国航空 | 中国国际航空 | 360关键词 | 国航 | 国航官网 | 中国国航 | 中国航空 | 中国国际航空,中国国际航空公司官网
flights.ctrip.com,交通旅游,携程机票,百度关键词 | 携程网上订票飞机票 | 机票查询 | 飞机票 | 机票查询携程网上订票 | 携程机票 | 360关键词 | 机票查询 | 飞机票 | 航班查询 | 携程机票 | 航班,"携程机票官网提供飞机票查询,机票预订和特价机票查询,打折机票查询服务。携程同时动态提供航班查询,时刻表查询,机票查询时刻表票价,实时起降查询,以东方航空,中国南方航空,中国国航,深圳航空,厦门航空,海南航空,四川航空,春秋航空官方网站特价机票查询,是您网上订机票的首选。"
tuniu.com,交通旅游,途牛旅游网,百度关键词 | 途牛 | 途牛旅游网 | 途牛网 | 昆明大理丽江6日游报价 | 在线天堂www在线...中文 | 360关键词 | 途牛 | 途牛旅游网 | 旅行 | 俄罗斯旅游 | 昆明大理丽江六日游,"途牛旅游网提供跟团游、自助游、邮轮旅游、自驾游、定制游以及景点门票预订、机票预订、火车票预订服务,还有牛人专线、首付出发旅游等品质高端、价格实惠的旅游路线.全年有各种尾货特价、限时秒杀等特卖旅游路线让你畅游海内外,要旅游,找途牛."
csair.com,交通旅游,中国南方航空,百度关键词 | 南方航空 | 南航 | 南方航空官网 | 中国南方航空 | 南航官网 | 360关键词 | 南方航空 | 南方航空官网 | 中国南方航空 | 南航官网 | 南航官网机票订票,"中国南方航空官网,提供国内国际机票预订,飞机票查询,航班查询,特价打折机票预订,明珠会员服务等。"
hotels.ctrip.com,交通旅游,携程酒店酒店预订,百度关键词 | 携程网上酒店 | 澳门皇冠 | 杭州酒店 | 贵州旅游自由行住宿 | 巴黎酒店预订 | 360关键词 | 锦江酒店 | 万信至格酒店 | 朗丽兹酒店 | 锦囊泛娱酒店 | 呆脑兽亲子主题酒店,"国内酒店预订,携程酒店为您提供国内数千城市的酒店预订,酒店价格查询,优质的宾馆住宿推荐、以及酒店地址、酒店图片,真实用户点评等酒店信息。携程拥有国内外数千万会员酒店,是中国领先的酒店预订服务中心。"
amap.com,交通旅游,高德地图,百度关键词 | 高德地图 | 高德 | 高德地图api | 高德地图车机版 | 高德开放平台 | 360关键词 | 高德地图 | 高德 | 高德地图api | 高德地图车机版 | 高德开放平台,高德地图官方网站，提供全国地图浏览，地点搜索，公交驾车查询服务。可同时查看商家团购、优惠信息。高德地图，您的出行、生活好帮手。
you.ctrip.com,交通旅游,携程旅游攻略,百度关键词 | 北京景点 | 成都旅游必去十大景点推荐 | 成都旅游攻略必去景点 | 南京旅游必去十大景点推荐 | 苏州旅游攻略必去景点推荐 | 360关键词 | 香格里拉 | 景德镇 | 井冈山 | 西安旅游必去景点攻略 | 红树林,"想不想来一次环球旅行,携程社区记录了全球数十万个城市的旅游景点,包括旅游攻略、地图、美食、住宿，分享用户游记，旅游心得，问答等等。要旅行，从携程开始。"
maoyan.com,休闲娱乐,猫眼电影,百度关键词 | 猫眼 | 猫眼电影 | 票房 | 猫眼实时票房 | 实时票房 | 360关键词 | 猫眼 | 猫眼电影 | 票房 | 猫眼实时票房 | 实时票房,国内观众优选的在线购票平台，用户流行的观影决策平台。
mipang.com,交通旅游,米胖网,百度关键词 | 重庆气温 | 湖南天气预报15天 | 建三江天气预报 | 浙西大峡谷 | 谷歌天气 | 360关键词 | 巴西天气 | 龙门山 | 土耳其天气 | 江浦 | 欧洲天气,米胖旅游网通过集合旅行社直销，不设400电话，只提供网络预订服务的独有模式，大程度降低中间环节的成本，帮助游客享受高性价比的旅游。同时提供丰富的旅游景点介绍和旅游攻略供您参考。
mapbar.com,生活服务,图吧,百度关键词 | 北京区号 | 898 | 232 | 意趣棋牌 | 企业电话名录 | 360关键词 | 石家庄公交 | 399 | 香港电话 | 棋牌室 | 852,"图吧地图是国内大的在线电子地图及无线地图服务提供商,市场占有率超过80％.图吧地图（map）为互联网和手机用户提供地图搜索、位置查询和公交,驾车线路等交通规划服务,为行业客户提供GIS行业应用解决方案和地图API产品,同时为中小企业客户提供推广必备的地图标注产品."
www.12306.cn,交通旅游,中国铁路客户服务中心,百度关键词 | 12306 | 火车票查询 | 铁路12306 | 12306官网 | 高铁票 | 360关键词 | 12306 | 火车票 | 12306网上订票官网 | 高铁 | 火车,"中国铁路客户服务中心（www.12306.cn）官方网站,可以查询旅客列车时刻表、票价、列车正晚点、车票余票、售票代售点、货物运价、车辆技术参数以及有关客货运规章。"
tcmap.com.cn,交通旅游,博雅地名网,百度关键词 | 博雅 | 民和县 | 博雅地图 | 博雅地图地名网 | 博雅地名网 | 360关键词 | 博雅 | 塘厦 | 博雅地图 | 博雅地图地名网 | 博雅地名网,"博雅地名网,中国行政区划,中国政区介绍,中国行政区划,中国各省份资料,中国行政区域划分,含中国各乡镇介绍,中国全的行政区划网站"
cncn.com,交通旅游,欣欣旅游网,百度关键词 | 在线测速 | 常州区号 | 0577 | 保定区号 | 旅行社旅游报价3日游 | 360关键词 | 邮编查询 | 深圳区号 | 昆明大理丽江6日游报价 | 昆明大理丽江6日游特价团 | 昆明大理丽江6天5晚,欣欣旅游网(cncn.com)中国在线旅游超市，4万家旅游顾问为您提供超过200万条旅游线路、门票、签证、机票、酒店等预订服务…为您量身定制不一样的旅行。
8684.cn,生活服务,8684公交网,百度关键词 | 太平洋时间 | 上海公交 | k8 | 312 | 广州公交 | 360关键词 | 中国高铁 | 南通地图 | 41 | 231 | 156,"8684公交是使用人数多,数据更新快的公交查询网站,长伴用户13年,覆盖400多个城市.提供公交车线路查询,公交线路,乘车路线查询,掌上公交,公交车来了等信息."
mafengwo.cn,交通旅游,蚂蜂窝,百度关键词 | 马蜂窝 | 江苏 | 河源 | 呼和浩特攻略旅游攻略 | 敦煌莫高窟旅游攻略 | 360关键词 | 马蜂窝 | 旅游 | 吉隆坡 | 敦煌莫高窟旅游攻略 | 贵州旅游攻略自由行最佳线路,"旅游网,自助游,旅游攻略,自驾游,路书信息来蚂蜂窝旅游网,蚂蜂窝旅游网获取旅游网信息,自助游,旅游攻略网,自驾游网站信息更全面。"
bbs.hupu.com,综合其他,虎扑体育论坛,百度关键词 | 足协杯 | 虎扑论坛 | 甜性涩爱 | 虎扑社区 | apl直播 | 360关键词 | 虎扑论坛 | 虎扑步行街 | 崩铁 | 马刺 | 虎扑社区,"虎扑体育论坛以NBA话题为主,包含CBA,足球,F1等内容的讨论,拥有热情而不失理性的良好讨论氛围,提供论坛版块定制等个性化功能."
bytravel.cn,交通旅游,博雅旅游网,百度关键词 | 挑码助手 | 海口彩票网加急版 | 斗鱼三骚 | 唐绍仪 | 肥城桃 | 360关键词 | 李锐 | 彝族年 | 友趣棋牌 | 盛庸 | 广西旅游必去十大景点排名,博雅旅游网（www.bytravel.cn）。
