url,industry,title,keywords,description
faloo.com,休闲娱乐,飞卢中文网,百度关键词 | 飞卢小说网 | 长相思小说 | 飞卢中文网 | 飞卢小说 | 小说txt | 360关键词 | 飞卢小说网 | 飞卢 | 飞卢中文网 | 飞卢小说 | 重生之门下载,"飞卢中文网（www.faloo.com）提供原创小说阅读,包括：言情小说,玄幻小说,同人小说,穿越小说、青春校园小说等精彩很Hi的小说在线阅读及小说下载。"
kuwo.cn,休闲娱乐,酷我音乐,百度关键词 | 酷我音乐 | 酷我 | 歌曲下载 | 波点音乐 | 只因你太美 | 360关键词 | 音乐 | 酷我音乐 | 在线音乐 | 酷我 | 音乐在线听,"酷我音乐是无损音乐正版在线试听网站,酷我音乐为您提供高品质音乐,无损音乐下载,免费无损下载,hifi音乐下载,音乐播放器,音乐在线听等服务.酷我音乐拥有权威的音乐榜单,快捷的新歌速递,完善的主题电台,个性化的歌曲推荐,好音质,用酷我"
qianp.com,休闲娱乐,千篇网,百度关键词 | 扫雷 | 部首 | 正则 | 品茗 | 天根 | 360关键词 | 高压监狱 | 以小见大 | 肝胆相照 | 四点底 | 万事如意,千篇网-一个懂你的资源、知识、资讯分享网站
ximalaya.com,休闲娱乐,喜马拉雅FM,百度关键词 | 喜马拉雅 | 喜马拉雅听书免费版 | 喜马拉雅听书 | 喜马拉雅fm | 喜马拉雅app官网 | 360关键词 | 喜马拉雅 | 喜马拉雅听书免费版 | 有声小说 | 听书 | 美美与共,喜马拉雅fm是专业的音频分享平台，汇集了有声小说，有声读物，有声书，儿童睡前故事，相声小品，鬼故事等数亿条音频，超过4.5亿用户选择的网络电台。听书，听小说等有声读物，就在喜马拉雅fm。随时随地，听我想听。
yx007.com,休闲娱乐,007小游戏,百度关键词 | 韩剧tv官方下载 | tiktok国际版下载 | 云海电视 | 电视家4.0永久免费版 | vidhub | 360关键词 | 骏游斗地主赚钱版 | 次元城动漫下载 | 牛牛视频 | 热血江湖私发网 | 小苹果影视tv,007小游戏（www.yx007.com）为您提供好玩的小游戏、在线小游戏、双人小游戏、无敌版小游戏、化妆小游戏、连连看小游戏、黄金矿工小游戏、斗地主小游戏、超级玛丽小游戏、美女小游戏、mm小游戏、做饭小游戏、成人小游戏、33666小游戏等。
jianshu.com,休闲娱乐,简书,百度关键词 | 简书 | lvs | rps | 蜜柑计划 | v-if | 360关键词 | 简书 | jwt | 思维导图软件 | prd | markdown语法,简书是一个将写作与阅读整合在一起的阅读社区。隶属于上海佰集信息科技有限公司。
huya.com,休闲娱乐,虎牙直播,百度关键词 | 虎牙 | 虎牙直播 | huya | hy | huy | 360关键词 | 虎牙 | 虎牙直播 | huya | hy | huy,"虎牙直播是第一游戏直播互动平台,200万人同时在线,提供高清、流畅的赛事直播和游戏直播.虎牙包含英雄联盟lol直播、dota2直播、dnf直播等热门游戏直播以及单机游戏、手游等游戏直播"
gamersky.com,休闲娱乐,游民星空,百度关键词 | 游民星空 | 游民 | 游民星空官网 | gamersky | 好运连连棋牌游戏 | 360关键词 | 游民星空 | 游民 | 赛博朋克2077 | 暗黑4 | 黑色沙漠 游戏,"游民星空是国内单机游戏门户网站,提供具特色的游戏资讯,新全的游戏下载,大量游戏攻略,经验,评测文章,以及新热门游戏资料专题。"
liqucn.com,休闲娱乐,历趣,百度关键词 | 温州云阅卷 | CF助手下载 | 图司机 | 招商证券智远一户通 | 快手小店商家版 | 360关键词 | 历趣 | 普大喜奔 | 历趣市场 | 手机应用程序 | 应用软件下载APP,历趣（www.liqucn.com）手机应用程序商店。提供海量手机应用软件、手机游戏、手机主题免费下载。
yw11.com,休闲娱乐,起名网,百度关键词 | 芃 | 嵊 | 起名网 | 森 | 胍 | 360关键词 | 名字 | 取名 | 起名 | 微信名 | 五行属金的字,"起名网是免费起名,取名,姓名测试综合起名字网站.提供起名字大全,周易免费起名,姓名测试打分等在线起名服务,专业的宝宝起名取名网."
hongxiu.com,休闲娱乐,红袖添香,百度关键词 | 红袖添香 | 肉文 | 我叫赵甲第小说 | 红楼如此多骄 | 孙悟空的人生模拟器 | 360关键词 | 红袖添香 | 小黄文 | 红袖添香小说网 | 爱在天上 | 夜的命名,"红袖添香唯一官方网站。红袖提供古言、现言、原创、玄幻、都市、言情、娱乐、种田、科幻、悬疑、灵异、穿越、重生、宠文等小说,全本免费手机小说阅读推荐,精彩尽在红袖添香。"
www.ixigua.com,休闲娱乐,西瓜视频,百度关键词 | 西瓜视频 | 亮剑 | 平凡的世界 | 大鱼海棠 | 为歌而赞 | 360关键词 | 西瓜视频 | 近1亿人次观看周杰伦线上演唱会 | 虹桥火车站遇离沪潮:进站排2小时 | 中国女排排名升至世界第二 | 中国女排战胜土耳其女排,西瓜视频由今日头条出品，主打个性化短视频推荐。截止到今年5月底，西瓜视频日活跃用户已经超过1000万，用户数达到1亿。
ali213.net,休闲娱乐,游侠网,百度关键词 | 游侠网 | 单机游戏 | 游侠对战平台 | s11 | 单机游戏之家 | 360关键词 | 游侠网 | 游侠 | 单机游戏 | 泰拉瑞亚 | dread hunger,游侠网为单机游戏玩家提供最新单机游戏业界动态、国内外单机游戏下载、单机游戏补丁、单机游戏攻略秘籍、单机游戏专题等内容。坚守单机阵地，弘扬单机文化！
2265.com,休闲娱乐,2265安卓网,百度关键词 | 火星直播 | 磁力猫最新版地址 | 侠盗飞车游戏 | 伯索学生端app | 模拟器游戏手机版 | 360关键词 | 晴天 | wink | 捕鱼下载 | 月光影院免费视频 | 淘宝下载安装,2265安卓网（www.2265.com）是提供(Android)安卓游戏下载的专业安卓站点。
www.douyin.com,休闲娱乐,抖音短视频,百度关键词 | 抖音 | 劳斯莱斯年审时被拉爆缸 | 抖音网页版 | 抖音官网 | douyin | 360关键词 | 抖音 | 抖音网页版 | 抖音官网 | douyin | 抖音下载,抖音，是一款可以拍短视频的音乐创意短视频社交软件，该软件于2016年9月上线，是一个专注年轻人的15秒音乐短视频社区。用户可以通过这款软件选择歌曲，拍摄15秒的音乐短视频，形成自己的作品。此APP已在Android各大应用商店和APP Store均有上线。
4399.com,休闲娱乐,4399小游戏,百度关键词 | 4399 | 4399小游戏 | 4399小游戏官网 | 4399.com | 4399游戏大全 | 360关键词 | 4399 | 4399小游戏 | 4399游戏盒 | 4399小游戏官网 | 节奏大师,"4399是中国领先的小游戏专业网站,免费为你提供小游戏大全,4399洛克王国小游戏,双人小游戏,连连看小游戏,赛尔号,奥拉星,奥奇传说小游戏,造梦西游3等新小游戏。"
koolearn.com,教育文化,新东方在线,百度关键词 | 新东方在线 | 四级考试报名官网 | usnews世界大学排名 | 新东方雅思 | 新东方考研 | 360关键词 | 新东方在线 | 雅思听力评分标准 | 英语四级考试时间 | 新东方考研 | 新东方考研在线官网,新东方在线是由新东方集团全资创办官方网校，提供出国留学、考研培训、英语培训和职业教育培训的综合网络教育培训机构，依托强大的新东方师资力量与教学资源，拥有先进的教学内容开发与制作团队，致力于为广大用户提供个性化、互动化、智能化的卓越在线学习体验。
puchedu.cn,教育文化,蒲城教育网,百度关键词 | 加强政治理论学习 | 为国家富强而奋斗的杰出人物手抄报 | 手抄报设计 | 挠脚心漫画 | 二年级手抄报 | 360关键词 | 奥特曼简笔画图片大全 | 100个简单的手工小制作 | 防疫黑板报 | 华表简笔画 | 小学生自制暗器100种,蒲城县教育局官方网站
xdf.cn,教育文化,新东方,百度关键词 | 新东方 | 新东方英语 | 新东方官网 | 北京中考时间2023年时间表 | 新东方云教室 | 360关键词 | 新东方 | 立冬习俗 | 七年级上册英语 | 新东方雅思 | 美剧排行榜前十名,新东方网（www.xdf.cn）是新东方教育科技集团推出的一站式学习互动交流平台，新东方网的内容涵盖了英语学习规划、成长导航、新东方搜课、新东方老师答问、在线咨询、网上测评、学习资讯、新东方学员服务、新东方社区等，更多精彩内容尽在新东方网。
dongao.com,教育文化,东奥会计在线,百度关键词 | 东奥 | 金额大写 | 净资产收益率计算公式 | 发票真伪查询 | 流动比率计算公式 | 360关键词 | 东奥 | 东奥会计 | 东奥会计在线 | 东奥会计在线网课 | www.dongao.com,"东奥会计在线是国内知名大型会计远程教育网校,提供注册会计师考试培训,初级、中级会计职称考试培训,注册税务师考试培训,会计继续教育培训,从业资格考试辅导。另外提供各类考试真题,模拟试卷,名师课件,疑难解答,考前强化,考后成绩查询等考试信息。"
xuexila.com,教育文化,学习啦,百度关键词 | 党建总结 | 爱人 电影 | 学习新党章 | 飞得更高歌词 | 学习啦 | 360关键词 | 脑筋急转弯 | 榜样的力量 | 通知 | 时光荏苒 | 偷着乐,学习啦（www.xuexila.com）在线学习网是一个学习、互助的平台，在这里你可以免费学习各种知识，包括：学习方法、记忆力/脑力提升、时间管理、英语学习、考试辅导、各种生活知识以及学习资料下载。
fanyi.youdao.com,教育文化,有道翻译,百度关键词 | 有道翻译 | 有道翻译在线 | 有道在线翻译 | 有道词典在线翻译 | 网易翻译 | 360关键词 | 有道翻译 | 有道翻译在线 | 翻译 在线 | 有道在线翻译 | 网易翻译,有道翻译提供即时免费的中、英、日、韩、法文全文翻译、网页翻译服务。
diyifanwen.com,教育文化,第一范文网,百度关键词 | 思想汇报 | 入团志愿书 | 大悲咒 | 入党志愿 | 入党介绍人意见 | 360关键词 | 入党志愿书 | 租房合同 | 生日祝福语 | 劳动合同 | 检讨书,第一范文网（www.diyifanwen.com）各种日常写作指导，同时提供范文参考。主要栏目有：范文大全、个人简历、教案下载、课件中心、 优秀作文、考试辅导、试题库、诗词鉴赏。
huatu.com,教育文化,华图教育官网,百度关键词 | 华图教育 | 华图 | 中国特色社会主义最本质的特征是 | 华图在线 | 中国特色社会主义最本质的特征 | 360关键词 | 华图教育 | 华图 | 华图在线 | 国考考试时间 | 长江学者,华图教育是华图宏阳股份旗下品牌，拥有遍布全国的数百家分支机构。主要产品包括中央和地方公务员招录考试辅导，事业单位、三支一扶、村官、选调生、招警等考试辅导。
ddnx.com,行业企业,大东女鞋 ,百度关键词 | 程普 | 聊天经典坑人套路 | 打12305投诉后悔了 | 12315不受理8条 | 1042 | 360关键词 | 蟹膏 | 轻浮 | 巫山神女 | 桑麻 | 工作责任心,大东女鞋官网ddnx.com 主要销售浙江大东鞋业有限公司的大东女鞋、大东女靴，和各种其它的大东鞋子。
qianlima.com,行业企业,千里马招标网,百度关键词 | 千里马招标网 | 乙方宝 | 千里马招标 | 全网商机 | 东莞市政府采购网 | 360关键词 | 千里马 | 千里马招标网 | 乙方宝 | 焦作市公共资源交易中心 | 千里马招标,千里马招标网是招标信息全、覆盖地区及招标行业广的招标网，每天更新50000条招标项目信息；千里马招标网已成为政府、招标单位、业主招标采购的首选平台；招投标就上千里马招标网。
www.adobe.com,行业企业,Adobe,百度关键词 | ps | adobe acrobat | adobe reader | adobe官网 | adobe photoshop | 360关键词 | ps | photoshop | adobe | adobe pdf | adobe官网,Adobe官方网站， 创建于1982年，是世界领先数字媒体和在线营销方案的供应商。公司总部位于美国加利福尼亚州圣何塞。
foodmate.net,行业企业,食品伙伴网,百度关键词 | 食品伙伴网 | 食品伙伴网标准下载 | 伙伴网 | 食品伙伴网国家标准下载 | 食品伙伴网 标准下载 | 360关键词 | 食品伙伴网 | 食品论坛 | 食品伙伴网国家标准下载 | 食品伙伴网标准下载中心 | 食品伙伴网 标准下载,"食品伙伴网是国内专业食品网站,关注食品安全,探讨食品技术,食品伙伴网论坛是中国大的食品技术交流社区，前端的食品技术讨论，专业的食品社区，与国内顶级食品专家的对话"
sto.cn,行业企业,申通快递,百度关键词 | 申通快递单号查询 | 申通 | 申通快递 | 申通快递查询 | 申通快递查询单号 | 360关键词 | 申通 | 申通快递 | 申通快递查询 | 申通快递电话 | 申通网点管家,"申通快递官网,申通快递,快递,发快递,快递员,业务员查询,上门取件,在线下单(寄件),申通营业网点查询,快递加盟,单号追踪跟踪查询,投诉电话查询,车辆信息,申通新闻,招聘等服务,全国统一客服热线：95543."
ems.com.cn,行业企业,中国邮政速递物流,百度关键词 | ems | ems快递单号查询 | 邮政快递 | ems快递查询 | 邮政单号查询 | 360关键词 | 邮政快递单号查询 | ems | ems快递单号查询 | 邮政快递 | 中国邮政快递查询,中国邮政速递物流（www.ems.com.cn）官方网站。
www.haier.com,行业企业,海尔官网,百度关键词 | 海尔空调 | 海尔 | 海尔智家 | 海尔官网 | 海尔集团 | 360关键词 | 海尔空调 | 海尔 | 海尔智家 | 海尔官网 | 海尔净水,青岛海尔集团产品官方网站，提供海尔智慧家庭智能家电全套解决方案，海尔冰箱、海尔空调、海尔洗衣机、海尔电视、海尔热水器、海尔厨电、海尔厨房、海尔电脑、海尔手机、海尔生活家电、海尔智能电器等新全产品信息发布查询及排行榜，会员权益、优惠活动、购买渠道选择、售后服务、网上报修等一站式体验。
oracle.com,行业企业,Oracle 官网,百度关键词 | oracle | 甲骨文 | jdk下载 | oracle数据库 | oracle官网 | 360关键词 | oracle | jdk | jdk下载 | oracle官网 | java17,oracle offers a comprehensive and fully integrated stack of cloud applications and platform services.
xbiao.com,行业企业,腕表之家,百度关键词 | 腕表之家 | 劳力士绿水鬼 | 手表论坛 | 5172 | 腕表之家官网 | 360关键词 | 腕表之家 | 手表 | 理查德米勒 | 绿水鬼 | hublot,"腕表之家(xbiao.com)为您提供新手表品牌排名,新手表报价信息,手表品牌官网信息,并包括手表新闻,手表图片,手表论坛,手表购买,手表维修等内容,为您购买品牌手表提供有价值的参考,是爱表人士的佳交流平台."
mysteel.com,行业企业,我的钢铁网,百度关键词 | 我的钢铁网 | 我的钢铁 | 钢铁网 | 我的钢材网 | 上海钢联 | 360关键词 | 我的钢铁网 | 我的钢铁 | mysteel | 我的钢材网 | 钢材网,"我的钢铁网是中国钢铁行业钢材价格信息全面的门户网站，包括钢铁网,钢材网,钢铁价格,钢材价格,钢铁行情,钢材行情,钢材价格走势,钢铁价格走势,钢铁市场,钢材市场,钢铁行业分析等信息，为国内钢铁企业、钢材企业提供新的钢材价格行情资讯和钢材现货电子商务服务。"
znds.com,综合其他,智能电视网,百度关键词 | 电视app | znds | 智能电视论坛 | 电视论坛 | 85寸电视长宽多少厘米 | 360关键词 | 影视 | 电视盒子 | 韩国综艺 | 智能电视网 | uhd,智能电视网致力于打造国内第一智能电视门户www.znds.com，我们专注推动国内智能电视和智能机顶盒发展。团队具有十余年资深互联网经验和强大的技术实力，因为我们用心，所以我们更加专业！
sgcc.com.cn,行业企业,国家电网公司,百度关键词 | 国家电网 | 国家电网招聘网官网 | 国家电网招聘 | 网上国网 | 国网电子商务平台 | 360关键词 | 国家电网 | 国家电网招聘网官网 | 国家电网招聘 | 95598 | 国网,国家电网公司官网（www.sgcc.com.cn）。
www.189.cn,行业企业,中国电信网上营业厅,百度关键词 | 电信 | 中国电信网上营业厅 | 电信营业厅 | 电信宽带 | 中国电信营业厅 | 360关键词 | 中国电信 | www. | 电信 | 中国电信网上营业厅 | 电信营业厅,中国电信网上营业厅（www.189.cn）为您提供手机购买、充值交费、业务办理、费用查询、帐单查询、积分查询、选号、在线客服、故障申告、投诉咨询及业务介绍等全方位的电子自助服务；中国电信—世界触手可及。
bajiu.cn,行业企业,八九网,百度关键词 | 实景地图 | 北斗卫星地图 | 天荒地老 | 北斗卫星实景地图 | 三维地图实景免费版 | 360关键词 | 北斗地图 | 世界时钟 | 89 | 北斗地图高清卫星地图 | 北斗卫星实景地图,八九网，bajiu.cn，是专业的网上查询系统，是免费的问题索答平台。八九网期待着与您一道，分享知识，体验快乐！89网，欢迎您再次光临。
hp.com,行业企业,惠普官方网站,百度关键词 | 惠普官网 | hp | 惠普打印机 | 惠普打印机驱动 | hp官网 | 360关键词 | 惠普官网 | 惠普 | hp | 惠普打印机 | 惠普打印机驱动,购买，了解更多惠普打印机，笔记本，台式机 等相关信息。
elecfans.com,行业企业,电子发烧友,百度关键词 | 电子发烧友 | 电子发烧友网 | 电子发烧友论坛 | 电子论坛 | 2280 | 360关键词 | 电子发烧友 | hd | pga | 开根号 | 模拟电路,"电子发烧友网站提供各种电子电路，电路图，原理图,IC资料，技术文章，免费下载等资料，是广大电子工程师所喜爱电子资料网站。"
samsung.com,行业企业,三星电子,百度关键词 | 三星 | 三星手机 | samsung | 三星打印机官网 | 三星手机官网 | 360关键词 | 三星 | 三星官网 | 三星官网网站 | samsung | 三星打印机官网,三星手机等产品官方网站。想象三星能为您做什么？在这里您可以找到三星手机、三星笔记本、三星显示器、三星电视、三星数码相机、三星打印机、三星家电等三星产品官方介绍及服务支持信息。
www.10086.cn,行业企业,中国移动通信集团公司,百度关键词 | 中国移动 | 中国移动官网 | 移动 | 移动网上营业 | 中国移动网上营业厅 | 360关键词 | 中国移动 | 10086 | 中国移动官网 | 移动 | 移动网上营业,中国移动通信集团公司（www.10086.cn）是中国规模大的移动通信运营商，主要经营移动话音、数据、IP电话和多媒体业务，并具有计算机互联网国际联网单位经营权和国际出入口局业务经营权。
chinapp.com,行业企业,中国品牌网,百度关键词 | 品牌网 | 自行车品牌排行榜前十名 | 排行榜 | 中国品牌网 | 月子会所 | 360关键词 | 品牌 | 品牌网 | 灯具品牌排行前十名 | 奶茶品牌 | 热水器哪个牌子好十大排名,"中国品牌网,中文品牌网,全球品牌网,中国品牌网,中国第一品牌网,全球中文品牌网"
www.microsoft.com,行业企业,微软官网,百度关键词 | excel | windows | edge | 微软官网 | microsoft | 360关键词 | excel | windows10 | windows | edge | microsoft,微软（Microsoft），是一家总部位于美国的跨国科技公司，是世界PC（Personal Computer，个人计算机）机软件开发的先导，由比尔&#183;盖茨与保罗&#183;艾伦创办于1975年，公司总部设立在华盛顿州的雷德蒙德市（Redmond，邻近西雅图）。以研发、制造、授权和提供广泛的电脑软件服务业务为主。
yto.net.cn,行业企业,圆通快递官网,百度关键词 | 圆通快递查询单号 | 圆通 | 圆通快递 | 圆通快递查询 | 圆通速递 | 360关键词 | 圆通 | 圆通快递 | 圆通快递查询 | 圆通速递 | 圆通官网,圆通速递创建于2000年5月28日，经过近十四年的发展，已成为一家集速递、航空、电子商务等业务为一体的大型企业集团，形成了集团化、网络化、规模化、品牌化经营的新格局，为客户提供一站式服务
xinpianchang.com,行业企业,新片场,百度关键词 | 新片场 | 企业宣传片 | 新片 | 新片场视频素材 | 公司的宣传片 | 360关键词 | 新片场 | ok模板网 | 中老铁路线路图 | 布谷tv | 新片场视频素材,新片场是国内专业的影视创作人社区，汇聚众多优秀创作人，提供作品展示、项目交流、拍摄制作机会等影视行业服务。在这里，你可以找到合适的创作人；在这里，用作品打动世界！
tencent.com,行业企业,腾讯,百度关键词 | 腾讯会议 | 腾讯云 | 腾讯 | 腾讯会议app下载 | 腾讯会议电脑版 | 360关键词 | 腾讯会议 | 腾讯云 | 腾讯招聘 | 腾讯会议官网 | 腾讯会议网页版,腾讯公司官网，深圳市腾讯计算机系统有限公司成立于1998年11月，由马化腾、张志东、许晨晔、陈一丹、曾李青五位创始人共同创立。  是中国大的互联网综合服务提供商之一，也是中国服务用户多的互联网企业之一。
11467.com,行业企业,顺企商务网,百度关键词 | 顺企网 | iso20000 | sdfsf | 隐形纱窗生产厂家电话 | 抖店入驻 | 360关键词 | 顺企网 | ncc | eac | 自动化生产线机械手 | 巨量千川推广怎么投,"顺企网（www.11467.com）于2007年4月创建，是全国企业信息平台, 这里收集了广大企业的基本信息, 企业也可以在这里完善资料而成为一个独立的网站。"
sf-express.com,行业企业,顺丰快递官网,百度关键词 | 顺丰 | 顺丰快递单号查询 | 顺丰快递 | 顺丰快递查询 | 顺丰官网 | 360关键词 | 顺丰 | 顺丰快递单号查询 | 顺丰快递 | 顺丰快递查询 | 顺丰官网,"顺丰快递官方网站（www.sf-express.com）,顺丰速运（集团）有限公司（以下简称顺丰）于1993年成立，总部设在深圳，是一家主要经营国内、国际快递及相关业务的服务性企业。"
huangye88.com,行业企业,黄页88网,百度关键词 | 消防网 | 黄页88网 | 软文轩 | 中国黄页网 | 消防维保公司 | 360关键词 | 黄页88 | 黄页 | 阿法拉伐 | 消防网 | 焦化厂,黄页88（www.huangye88.com）是中国领先的免费发布供求信息B2B电子商务网站，汇集海量免费企业黄页信息、供求信息，企业可以免费发布供求信息、免费发布信息、免费发布产品信息。黄页88免费企业黄页大全网站是帮助企业网络销售产品、网上营销、网站推广的首选B2B网站。
dbw.cn,综合其他,东北网,百度关键词 | 东北 | 东北网 | 破解版游戏下载 | 绥化新闻网 | 鸡西新闻网 | 360关键词 | 东北网 | 通缉令 | 通缉 | 虎头要塞 | 助企纾困,"东北网,黑龙江东北网,东北新闻,黑龙江门户网站,黑龙江,黑龙江新闻,东北网评,东北社区,博客,新闻线索,综合,电子报,手机报,龙江视频,民声,资讯,房产,汽车,健康,旅游,生活,企业,IT,访谈。"
rednet.cn,综合其他,红网,百度关键词 | 红网 | 醴陵 | 问政湖南 | 湖南红网 | 红网论坛 | 360关键词 | 红网 | 问政湖南 | 红辣椒 | 湖南红网 | 斗争精神,红网是湖南省委、省政府重点新闻网站，湖南综合门户网站，于2001年成立，2006年进入湖南出版投资控股集团，2010年红网随中南传媒一同上市，成为全国首家上市的地方新闻网站。目前综合实力位居全国地方新闻网站首位，国内所有新闻网站前九。
news.ifeng.com,新闻媒体,凤凰资讯,百度关键词 | 凤凰资讯 | 凤凰新闻网 | 凤凰资讯台 | www 88btbt cnm | 大翻译运动 | 360关键词 | 凤凰新闻 | 凤凰资讯 | 在人间 | 大翻译运动 | 何韵诗,凤凰网资讯、凤凰网新闻24小时提供大陆、台湾、香港、国际重大新闻资讯，每天发布财经、房产、汽车、军事、历史、文化、教育、娱乐、时尚、亲子等数万条新闻。
guancha.cn,新闻媒体,观察者网,百度关键词 | 观察者网 | 观察者 | car-t | 观察者网-中国关怀 全球视野 | 观察网 | 360关键词 | 观察者网 | 观察者 | 五十度灰 | 这就是中国 | 航母,观察者网，致力于荟萃中外思想者精华，鼓励青年学人探索，建中西文化交流平台，为崛起中的精英提供决策参考。      
huawei.com,行业企业,华为,百度关键词 | 华为 | 华为官网 | 华为手机助手 | 华为云空间 | huawei | 360关键词 | 华为 | 华为官网 | 华为云 | 华为手机助手 | 华为云空间,huawei is a leading global provider of information and communications technology (ict) infrastructure and smart devices.
mgtv.com,新闻媒体,芒果TV,百度关键词 | 芒果tv | 以爱为营 | 向往的生活 | 芒果tv官网 | 爱的修学旅行 | 360关键词 | 芒果tv | 芒果tv官网 | 芒果 | mgtv | 乘风破浪的姐姐4,芒果TV，由湖南快乐阳光互动娱乐传媒有限公司（简称“快乐阳光”）负责具体运营。公司系湖南广播电视台全力发展网络视频业务的唯一新媒体机构，是芒果传媒旗下全资子公司。快乐阳光成立于2006年5月，自2008年开始启用芒果TV作为视频平台呼号，通过数年发展，形成以“芒果TV”为品牌的产业格局，包括芒果TV（互联网
