url,industry,title,keywords,description
kaola.com,购物网站,考拉海购,百度关键词 | 考拉 | 考拉海购 | 大鹅羽绒服官网旗舰店 | 网易考拉 | 考拉软件 | 360关键词 | 蜗牛家 | 考拉 | 考拉海购 | 网易考拉 | CK皮带,“考拉海购”是网易旗下自营海外正品特卖网站——主打母婴用品、美妆个护、食品保健、家居数码和服饰鞋包等类目。
aliexpress.com,购物网站,AliExpress,百度关键词 | 速卖通 | aliexpress | 速卖通官网 | 全球速卖通 | 速卖通官网入口 | 360关键词 | 速卖通 | aliexpress | 速卖通官网 | 全球速卖通 | 18younggay video,"Online Shopping for Cheap Automotive, Phones Accessories, Computers Electronics, Fashion, Beauty Health, Home Garden, Toys Sports, Weddings Events from China; Shopping on Aliexpress |the world"
wbiao.cn,购物网站,万表网,百度关键词 | 万表网 | 卡地亚手表价格 | 万表网官网 | 腕表网 | 名表网 | 360关键词 | 万表网 | k金 | 黑水鬼 | 万表 | 帝舵手表二手价格,万表网（www.wbiao.cn）销售原装正品世界名表：浪琴手表、天梭手表、梅花手表、依波路手表、欧米茄手表、劳力士手表，买手表可信用卡分期付款！
www.tmall.com,购物网站,天猫,百度关键词 | 天猫 | 天猫官方旗舰店 | 天猫官网 | tmall | 天猫商城 | 360关键词 | 天猫 | 天猫官方旗舰店 | 天猫官网 | tmall | 天猫商城,"天猫，中国线上购物的地标网站，亚洲超大的综合性购物平台，拥有10万多品牌商家。每日发布大量国内外商品！正品网购，上天猫！天猫千万大牌正品,品类全，一站购，支付安全，退换无忧！理想生活上天猫!"
,购物网站,亚马逊官方网站,百度关键词 | amazon | 亚马逊美国 | 美亚 | www.amazon.com | 亚马逊美国站 | 360关键词 | amazon | 亚马逊美国 | 美国亚马逊 | 美亚 | 亚马逊美国站,美国亚马逊官方网站（www.amazon.com）。
vip.com,购物网站,唯品会,百度关键词 | 唯品会 | 唯品会官网 | 唯品 | weipinhui | 唯品网官方网站 | 360关键词 | 唯品会 | 唯品会官网 | 唯品 | weipinhui | 唯品网官方网站,唯品会vip购物网以1-7折超低折扣对全球各大品牌进行限时特卖，商品囊括服装、化妆品、家居、奢侈品等上千品牌。100%正品、低价、货到付款、7天无理由退货。
meituan.com,购物网站,美团,百度关键词 | 美团 | 美团开店宝 | 美团外卖商家版 | 美团外卖 | 开店宝 | 360关键词 | 美团 | 美团外卖商家版 | 美团外卖 | 美团商家 | 美团招聘,"美团网:美食攻略,外卖网上订餐,酒店预订,旅游团购,飞机票火车票,电影票,ktv团购吃喝玩乐全都有!店铺信息查询,商家评分/评价一站式生活服务网站"
vmall.com,购物网站,华为商城,百度关键词 | 华为商城 | 华为商城官网 | vmall | freebuds3 | 华为手机官方商城 | 360关键词 | 华为商城 | 华为商城官网 | vmall | matex5 | 华为手机官方商城,华为商城是华为旗下面向全国服务的电子商务平台。我们提供正品华为品牌手机、平板电脑、移动终端、家庭终端、配件等全新商品。品质保证！
cnhnb.com,购物网站,惠农网,百度关键词 | 惠农网 | 农产品交易网 | 桂鱼多少钱一斤 | 大黄鱼养殖 | 我国盐碱地分布 | 360关键词 | 惠农网 | 北瓜 | 一年四季不愁销路的生意 | 10万农村独立小院出售 | 青储小麦,"惠农网作为专业的线上农产品批发交易市场,用户不仅可以在平台上免费发布农产品供求信息,了解中国农产品价格行情,进行农产品批发和农产品交易,农产品加盟,还可免费享受袁隆平等专家的专业咨询服务"
jiaoyimao.com,购物网站,交易猫,百度关键词 | 交易猫 | 交易猫手游交易平台 | 交易猫官网 | 和平精英小号购买平台 | 交易猫交易平台官网 | 360关键词 | 交易猫 | 交易猫手游交易平台 | 交易猫官网 | 交易 | 账号交易,交易猫是国内专业的手机游戏交易平台，安全可靠的手游交易网站，提供手游账号交易、买号卖号、苹果代充值、游戏充值、首充号、装备道具、游戏币交易的手机网游交易平台！
dangdang.com,购物网站,当当网,百度关键词 | 当当网 | 当当 | 当当网官网书店 | 重启人生 | 书 | 360关键词 | 当当网 | 当当 | 当当网官网书店 | 当当云阅读 | 图书,全球领先的综合性网上购物中心。超过100万种商品在线热销！图书、音像、母婴、美妆、家居、数码3C、服装、鞋包等几十大类，正品行货，低至2折，700多城市货到付款，（全场购物满29元免运费。当当网一贯秉承提升顾客体验的承诺，自助退换货便捷又放心）。
mplife.com,购物网站,名品导购网,百度关键词 | bt兔子磁力在线搜索 | 右键召唤 | 整蛊火柴人 | 羞羞视频app | qooapp苹果版下载 | 360关键词 | 名品 | 导购网 | 名品导购网 | 名品网 | 推荐吧,"名品导购网是中国领先的城市消费生活导购门户,上海地区知名、权威的女性消费领域线上线下相结合的平台。我们拥有上海深入全面的品牌、商场折扣促销信息、划算的特卖信息，境外消费旅游指导、国内外时尚明星动态以及消费社区论坛。海量的购物资讯、完善的会员服务、丰富的互动活动，造就名品导购网极强的消费驱动力"
ziyimall.com,购物网站,紫一健康保健品商城,百度关键词 | 怎样才能交而不泄 | 桑叶茶又叫短命茶 | 男性自慰 | 杰士邦和杜蕾斯哪个好 | 三十种b哪个好 | 360关键词 | 69 | 家里一个人查出幽门螺旋杆菌 | 契默契 | 印度神油 | 私下黑怎么能迅速变粉,紫一营养保健品商城专业提供：男性、女性、儿童、中老年的营养保健品商城，做消费者值得信赖的保健品网上商城。我们承诺:正品保障、假一罚十、30天无条件退换货!
duitang.com,休闲娱乐,堆糖网,百度关键词 | 堆糖 | 堆糖网 | duitang | 朴信惠图片 | 堆图 | 360关键词 | 堆糖 | 堆糖网 | 时代少年团壁纸 | duitang | 头像女下半部位图片,来堆糖收集发现美好的物品，展示所爱，分享生活。
suning.com,购物网站,苏宁易购,百度关键词 | 苏宁易购 | 苏宁 | 苏宁易购官网 | 联想威6 2020 | 苏宁易购官网商城 | 360关键词 | 苏宁易购 | 苏宁 | 苏宁易购官网 | 苏宁易购官网商城 | 四轮观光车电动车价格,"苏宁易购，是苏宁电器集团的新一代B2C网上商城，于2009年8月18日上线试运营。2010年1月25日，苏宁电器在南京总部宣布，公司的B2C网购平台“苏宁易购”将于2月1日正式上线，并将自主采购、独立运营，苏宁电器也由此正式出手电子商务B-t-C领域。2011年5月25日正式启用.com域名，原.cn域名跳转至.com域名。
"
made-in-china.com,购物网站,中国制造网,百度关键词 | 中国制造网 | made in china | madeinchina | 厂家 | www.made-in-china.com | 360关键词 | 中国制造网 | made in china | pussy | 中国制造 | madeinchina,"source quality products made in china. find reliable china suppliers,manufacturers,factories,wholesalers & exporters on the leading b2b e-commerce website made-in-china.com."
amazon.cn,购物网站,亚马逊中国官网,百度关键词 | 亚马逊官网 | 亚马逊全球开店 | 亚马逊中国 | cn | 亚马孙 | 360关键词 | 亚马逊 | 亚马逊官网 | kindle | 亚马逊全球开店 | 亚马逊中国,亚马逊中国，原名卓越亚马逊，是一家B2C电子商务网站，前身为卓越网，2004年8月19日亚马逊公司宣布以7500万美元收购雷军和陈年创办的卓越网，将卓越网收归为亚马逊中国全资子公司。2007年将其中国子公司改名为卓越亚马逊。2011年10月27日亚马逊正式宣布将他在中国的子公司“卓越亚马逊”改名为“亚马逊中国”。
kongfz.com,购物网站,孔夫子旧书网,百度关键词 | 孔夫子旧书网 | 惠尚学 | 孔夫子旧书网官网 | 孔夫子网 | 旧书网 | 360关键词 | 孔夫子旧书网 | 孔夫子 | 惠尚学 | 孔夫子旧书网官网 | 孔夫子网,孔夫子旧书网是国内领先的古旧书交易平台，汇集全国各地13000家网上书店，50000家书摊，展示多达9000万种书籍；大量极具收藏价值的古旧珍本（明清、民国古籍善本，珍品期刊，名人墨迹，民国珍本，绝版书等）在孔网展示与交易，吸引了大量的学者、研究人员和藏书人长时间在线关注并参与。找图书网站、在网上买书、
alibaba.com,购物网站,Alibaba国际站,百度关键词 | 阿里巴巴国际站 | alibaba.com | 阿里巴巴招聘 | easyexcel | 阿里巴巴国际贸易网站 | 360关键词 | 阿里巴巴国际站 | 阿里国际站 | alibaba.com | easyexcel | 阿里巴巴国际贸易网站,"Find quality Manufacturers, Suppliers, Exporters, Importers, Buyers, Wholesalers, Products and Trade Leads from our award-winning International Trade Site. Import &amp;amp;amp; Export on alibaba.com"
xiaohongshu.com,购物网站,小红书,百度关键词 | 小红书 | 小红书网页版 | vlookup | 小红书官网 | 小红书app下载安装免费正版 | 360关键词 | 小红书 | 小红书商业化 | 小红书网页版 | 小红书官网 | 小红书网页版入口,小红书是一个主打出境购物攻略的移动应用，为用户推荐不同国家地区退税打折出行信息、各地本土品牌特色商品推荐等，2014年转型重点做跨境电商服务。行吟信息科技(上海)有限公司旗下。
maigoo.com,购物网站,买购网,百度关键词 | 电影下载 | 影院 | 手机棋牌游戏 | B2b商务平台 | 物业管理咨询公司 | 360关键词 | 万源富硒茶 | 槟榔 | 奥斯卡 | 写真摄影哪家好 | 2023网页游戏,"买购网|maigoo.com,是一站式企业-经销商-用户平台。您可以在买购网查询到：十大品牌、品牌招商、品牌排行榜、正规经销商-专卖店、热门网店、TOP热卖产品、名人、各种建材装修知识、图库、各类排行榜。是品牌招商、发布欲加盟求购信息、查询正规店铺、优秀产品的大型门户网站。"
taobao.com,购物网站,淘宝网,百度关键词 | 淘宝 | 淘宝网 | 千牛 | taobao | 咸鱼 | 360关键词 | 淘宝 | 淘宝网 | 千牛 | 闲鱼 | taobao,淘宝网 - 亚洲较大的网上交易平台，提供各类服饰、美容、家居、数码、话费/点卡充值… 数亿优质商品，同时提供担保交易(先收货后付款)等安全交易保障服务，并由商家提供退货承诺、破损补寄等消费者保障服务，让你安心享受网上购物乐趣！
jd.com,购物网站,京东商城,百度关键词 | 京东 | jd | 京东商城 | 京东商城官网 | 机屏幕放大器 | 360关键词 | 京东 | jd | 京东商城 | 京东商城官网 | 京麦,"京东商城-专业的数码网上购物商城,产品包括数码、家电、手机、电脑配件、网络产品等数万种商品直销,便捷，诚信的服务,为您提供愉悦的网上商城购物体验!"
china.cn,购物网站,中国供应商,百度关键词 | 中国供应商 | 触拓 | 中国供应商网 | 供应商网 | 佑游泳衣 | 360关键词 | 中国供应商 | 中国供应商网 | 艺术 | 艺术家 | 麦克维尔空调售后维修,中国供应商(www.china.cn)是基于我国经济建设趋势和企业发展需求，由中国互联网新闻中心推出的权威、诚信的网络贸易平台。
jiangxi.gov.cn,政府组织,中国江西省人民政府,百度关键词 | 江西省教育厅 | 江西省科技厅 | 江西省人民政府 | 江西省人力资源和社会保障厅 | 江西省企业登记网络服务平台 | 360关键词 | 江西省公共资源交易网 | 江西公共资源交易网 | 江西省教育厅 | 江西省科技厅 | 江西省企业登记网络服务平台,"中国江西省人民政府网,“”栏目发布的新官方“”的信息，详情访问中国江西省人民政府官方网站！"
zjzwfw.gov.cn,政府组织,浙江政务服务网,百度关键词 | 浙江政务服务网 | 浙里办 | 浙江政务网 | 浙江省政务服务网 | 浙江政务 | 360关键词 | 浙江政务服务网 | 浙里办 | 浙江政务网 | 浙江省政务服务网 | 浙江政务,浙江政务服务网是集行政审批、便民服务、政务公开、互动交流、效能监察等功能于一体，省市县统一架构、多级联动的网上政务服务平台，被形象地喻为“政务淘宝”、“云计算政务超市”。
1688.com,购物网站,阿里巴巴1688,百度关键词 | 1688 | 1688阿里巴巴批发网 | 阿里巴巴批发网1688 | 阿里巴巴采购批发平台1688 | 1688官网 | 360关键词 | 1688 | 阿里巴巴 | 1688阿里巴巴批发网 | 阿里巴巴批发网1688 | 机屏幕放大器,阿里巴巴（1688.com）是全球企业间（B2B）电子商务的著名品牌，为数千万网商提供海量商机信息和便捷安全的在线交易市场，也是商人们以商会友、真实互动的社区平台。目前1688.com已覆盖原材料、工业品、服装服饰、家居百货、小商品等12个行业大类，提供从原料--生产--加工--现货等一系列的供应产品和服务。
mca.gov.cn,政府组织,中华人民共和国民政部,百度关键词 | 志愿北京 | 中国志愿服务网 | 民政局 | 民政部 | 民政一体化政务服务平台 | 360关键词 | 中国志愿服务网 | 志愿服务 | 全国志愿服务信息系统 | 民政部 | 民政一体化政务服务平台,中华人民共和国民政部官方网站
hubei.gov.cn,政府组织,湖北省人民政府门户网站,百度关键词 | 湖北政务服务网 | 湖北省人民政府 | 鄂汇办 | 湖北省政府 | 湖北政务网 | 360关键词 | 湖北政务服务网 | 湖北省人民政府 | 鄂汇办 | 湖北省政府 | 湖北政务网,"hubei,湖北,湖北省,美丽湖北,投资湖北,湖北概况,湖北省人民,湖北省政府,湖北省人民政府门户网站,人民政府,政府,政务公开,政府领导,网上办事,互动交流,门户网站,www.hubei.gov.cn"
shanghai.gov.cn,政府组织,中国上海,百度关键词 | 上海市政府 | 上海市人民政府 | 上海市长 | 上海政府 | 上海人民政府 | 360关键词 | 上海市 | 上海市政府 | 上海市人民政府 | 中国上海 | 上海政府,“中国上海”是在上海市委、市政府领导亲自关心、指导下建立和发展起来的政府门户网站，始终坚持以努力建设“服务政府、责任政府、法治政府”为目标，以“为民、便民、利民”为宗旨，以发布政府信息、拓展网上办事、提供便民服务和开展互动交流为主要内容。
moj.gov.cn,政府组织,中华人民共和国司法部,百度关键词 | 法考 | 司法考试 | 司法部官网 | 司法局 | 司法部国家司法考试中心 | 360关键词 | 司法部 | 法考 | 司法考试 | 司法部官网 | 司法部国家司法考试中心,中华人民共和国司法部官方网站。
cas.cn,政府组织,中国科学院,百度关键词 | 中国科学院 | 物理所 | 上海光机所 | 中国科学报 | 中国科学院院刊 | 360关键词 | 中国科学院 | 中科院 | 物理所 | 上海光机所 | 中国科学院院刊,中国科学院官方网站
zjzs.net,政府组织,浙江教育考试院,百度关键词 | 浙江教育考试院 | 浙江省教育考试院 | 浙江省教育考试院网 | 浙江考试院 | 浙江考试院教育官网 | 360关键词 | 浙江教育考试院 | 浙江省教育考试院 | 浙江考试院 | www.zjzs.net | 浙江考试院教育官网,浙江教育考试院（www.zjzs.net）。
yn.gov.cn,政府组织,云南省人民政府门户网站,百度关键词 | 云南省 | 云南省科技厅 | 云南省教育厅 | 云南省财政厅 | 云南省公共资源交易中心 | 360关键词 | 云南省科技厅 | 云南省教育厅 | 云南省财政厅 | 云南省人民政府 | 云南省公共资源交易中心,云南省人民政府门户网站是云南省人民政府发布政务信息、提供在线服务、与公众互动交流、履行职能、为民服务的重要窗口。
cma.gov.cn,政府组织,中国气象网,百度关键词 | 中国气象局 | 中国气象网 | 气象局 | 中国气象 | 国家气象局 | 360关键词 | 中国气象局 | 中国气象网 | 气象局 | 中国气象 | 上海气象局,中国气象局政府门户网站。
www.pbc.gov.cn,政府组织,中国人民银行,百度关键词 | 中国人民银行 | 人民银行 | 央行 | 中国人民银行官网 | lpr利率 | 360关键词 | 中国人民银行 | 人民银行 | 央行 | 中国人民银行官网 | 人民银行官网,中国人民银行官网
jszg.edu.cn,政府组织,中国教师资格网,百度关键词 | 中国教师资格网 | 教师资格认定 | 教师资格证认定 | 中国教师资格网官网登录入口 | 教师资格认定官网 | 360关键词 | 中国教师资格网 | 教师资格网 | www.jszg.edu.cn | 中国教师资格网官网登录入口 | 教师资格认定官网,中国教师资格网是由教育部师范教育司领导、教育部教师资格认定指导中心具体承办的实施教师资格制度的官方工作网站
122.gov.cn,政府组织,公安部交通安全综合服务管理平台,百度关键词 | 12123 | 交管12123 | 12123交管官网 | 122 | 交管123123 | 360关键词 | 12123 | 交管12123 | 12123交管官网 | 122 | 交管123123,公安部交通安全综合服务管理平台官方网站
hainan.gov.cn,政府组织,海南省人民政府网,百度关键词 | 海南省考试局 | 海南省政府 | 海南省人民政府 | 海南e登记 | 海南考试局官网 | 360关键词 | 海南省考试局 | 海南省政府 | 海南省人民政府 | 海南e登记 | 海南考试局官网,海南省人民政府门户网站是海南省人民政府在互联网上发布政务信息、提供公共服务的重要平台，也是海南省人民政府各部门和各市、县政府与公众联络、交流，接受公众监督的重要窗口。省委书记罗保铭，省人大主任罗保铭，省长刘赐贵，政协主席于迅。
npc.gov.cn,政府组织,中国人大网,百度关键词 | 劳动合同法 | 公司法 | 安全生产法 | 刑法 | 国家法律法规数据库 | 360关键词 | 国家法律法规数据库 | 法律法规数据库 | 全国人民代表大会 | 法律法规 | 全国人民代表大会常务委员会,全国人大常委会官方网站，是全国人大及其常委会的重要舆论媒介，信息公开、服务代表、联系人民的重要平台。
tj.gov.cn,政府组织,天津政务网,百度关键词 | 天津摇号 | 天津小客车调控管理信息系统 | 天津会计 | 天津市人力资源和社会保障局 | 天津网上办事大厅 | 360关键词 | 天津摇号 | 小汽车摇号摇号官网 | 天津小客车调控管理信息系统 | 天津市政府采购网 | 天津网上办事大厅,天津政务网即天津市政府门户网站，是天津市人民政府各部门在互联网上发布政务信息，宣传天津，介绍天津的风土人情概况，向市民提供相关服务信息的总平台，是与公众联络和交流的总窗口。
nanjing.gov.cn,政府组织,中国南京,百度关键词 | 南京人事 | 南京市公共资源交易中心 | 南京市人力资源和社会保障局 | 南京人力资源和社会保障局 | 南京公共资源交易中心 | 360关键词 | 南京市公共资源交易中心 | 江北新区 | 南京市人力资源和社会保障局 | 南京公共资源交易中心 | 南京人力资源和社会保障局,南京市人民政府网
mofcom.gov.cn,政府组织,中国商务部网站,百度关键词 | 商务部 | 摩洛哥 | 商务部官网 | 中华老字号 | 商务局 | 360关键词 | 商务部 | 商务部官网 | 中华人民共和国商务部 | 中国商务部 | 外商投资法,中华人民共和国商务部网站
henan.gov.cn,政府组织,河南省人民政府门户网站,百度关键词 | 河南省人力资源和社会保障厅 | 河南省教育厅 | 全程电子化服务平台 | 河南省科技厅 | 河南省人力资源和社会保障厅官网 | 360关键词 | 河南省人力资源和社会保障厅 | 河南省教育厅 | 全程电子化服务平台 | 河南省科技厅 | 河南省人力资源和社会保障厅官网,河南省人民政府主办网站
gz.gov.cn,政府组织,中国广州政府门户网站,百度关键词 | 120救人返程遇车祸再救5人 | 广州摇号 | 广州市人力资源和社会保障局 | 广州中小客车指标管理系统 | 广州市市场监督管理局 | 360关键词 | 广州摇号 | 广州市人力资源和社会保障局 | 广州中小客车指标管理系统 | 阳光家缘 | 广州市市场监督管理局,"中国广州政府门户网站是由广州市人民政府主办,广州市人民政府办公厅,广州市科技和信息化局共同承办,由广州市机关信息网络中心(广州市政府门户网站编辑部)负责运维管理,利用政府的设备,网络和信息等资源整合建设而成.设置了"
cq.gov.cn,政府组织,重庆市政府网,百度关键词 | 重庆人力资源和社会保障局官网 | 重庆市人力资源和社会保障局官网 | 重庆人社 | 重庆市政府 | 渝快办 | 360关键词 | 重庆人力资源和社会保障局官网 | 重庆市人力资源和社会保障局官网 | 重庆人社 | 重庆市政府 | 渝快办,重庆市政府网是重庆市政府的官方网站，是重庆市政府服务社会公众的重要窗口、政府信息公开的第一平台、政民互动交流的重要渠道。
zj.gov.cn,政府组织,浙江省人民政府,百度关键词 | 浙政钉 | 浙江政府采购网 | 浙江会计之家 | 浙江省政府采购网 | 浙江疫情最新消息 | 360关键词 | 浙政钉 | 浙江政府采购网 | 浙江会计之家 | 会计继续教育 | 浙江省政府采购网,浙江省人民政府门户网站是省政府开展对外宣传、政务公开、为民服务和网上办事的总窗口。网站提供面向公众、法人、政府工作人员的公众服务内容，具备政府信息的导航和检索、网上办事的受理和反馈等功能，是“一站式”的政府门户网站。
mohrss.gov.cn,政府组织,中华人民共和国人力资源和社会保障部,百度关键词 | 全国事业单位招聘网 | 人社部 | 人力资源和社会保障局官网 | 人社局 | 人力资源和社会保障部 | 360关键词 | 人社部 | 人力资源和社会保障部 | 人力资源 | 人社部官网 | 人力资源社会保障部,中华人民共和国人力资源和社会保障部官方网站
stats.gov.cn,政府组织,中华人民共和国国家统计局,百度关键词 | 国家统计局 | 统计局 | 国家统计局官网 | 国家数据 | 中国统计局 | 360关键词 | 国家统计局 | 统计局 | 国家统计局官网 | 中国统计年鉴 | 国家数据,中华人民共和国国家统计局官方网站
gd.gov.cn,政府组织,广东省人民政府门户网站,百度关键词 | 广东省会计信息服务平台 | 广东省政府采购网 | 广东省教育厅 | 广东省科技厅 | 广东省教育考试院 | 360关键词 | 广东省会计信息服务平台 | 广东省政府采购网 | 广东省教育厅 | 广东省教育考试院 | 档案信息查询,广东省人民政府办公厅主办
it.sohu.com,网络科技,搜狐科技,百度关键词 | 科学上网 | zlibrary | 档案系统查询 | 图片版权网站 | express vpn | 360关键词 | apkpure | zlibrary | z library | typora破解 | 糖心vlog,搜狐科技是聚合互联网、智能硬件、创业投资、通讯数码等科技资讯的媒体平台，致力提供专业、酷炫的科技圈新资讯。
moe.gov.cn,政府组织,中华人民共和国教育部,百度关键词 | 教育部 | 教育部全国青少年普法网 | 教育部官网 | 青少年普法网 | 全国青少年普法网 | 360关键词 | 教育部 | 普通话成绩查询 | 教育部全国青少年普法网 | 教育部官网 | 青少年普法网,教育部政府门户网站由教育部办公厅主办，是教育部机关实施信息公开、新闻宣传、在线互动的线上窗口，提供标准版、手机版、客户端等访问形式。
chinatax.gov.cn,政府组织,国家税务总局,百度关键词 | 国家税务总局 | 国家税务总局官网 | 电子税务局 | 国家税务总局全国增值税发票查验平台 | 自然人电子税务局 | 360关键词 | 国家税务总局 | 国家税务总局官网 | 电子税务局 | 发票查验 | 国家税务总局全国增值税发票查验平台,国家税务总局互联网站建于1999年7月。在总局领导的大力支持关心下，近几年网站围绕税收中心工作，不断完善管理机制，丰富网站内容，增强网站功能，改进服务方式，网站水平有了显著的提高，在国信办近几年组织的政府门户网站评比中都取得了较好的名次。
jl.gov.cn,政府组织,吉林省人民政府门户网站,百度关键词 | 吉林智慧人社网上办事大厅 | 吉林省财政厅 | 吉林省科技厅 | 吉林省政府 | 吉林省疫情最新消息 | 360关键词 | 吉林智慧人社网上办事大厅 | 吉林省财政厅 | 吉林省科技厅 | 吉林省政府 | 吉林省教育厅,吉林省人民政府门户网站由吉林省人民政府主办，省政府办公厅承办，省政府各工作部门协办。吉林省政府网站管理办公室具体负责规划建设和日常运维管理。?
