url,industry,title,keywords,description
google.cn,综合其他,谷歌中国,百度关键词 | chrome | 谷歌地图 | google浏览器 | chrome浏览器 | 谷歌浏览器 | 360关键词 | chrome | google浏览器 | 谷歌浏览器官网 | chrome浏览器 | 谷歌浏览器,2010年3月23日凌晨，Google公司总部发表声明正式退出中国，终关闭中国版搜索服务，转用香港的服务器提供简体服务。
qunar.com,交通旅游,去哪儿,百度关键词 | 去哪儿网 | 去哪儿 | 去哪网 | 酒店预订 | 去哪儿官网订机票 | 360关键词 | 去哪儿网 | 去哪儿 | 机票 | 飞机 | 去哪网,去哪儿网（Qunar.com）是中国领先的无线和在线旅游平台，其网站上线于2005年5月，公司总部位于北京。去哪儿网致力于建立一个为整个旅游业价值链服务的生态系统，并通过科技来改变人们的旅行方式。去哪儿网通过其自有技术平台有效匹配旅游业的供需，满足旅游服务供应商和中国旅行者的需求。
ctrip.com,交通旅游,携程旅行网,百度关键词 | 携程 | 携程网 | 携程网上订票飞机票 | 携程旅行 | 成都旅游必去十大景点推荐 | 360关键词 | 携程 | 携程网 | 万信至格酒店 | 朗丽兹酒店 | 携程网上订票飞机票,携程旅行网是中国领先的在线旅行服务公司，向超过1400万会员提供集酒店预订、机票预订、度假预订、商旅管理、特惠商户及旅游资讯在内的全方位旅行服务。
youdao.com,综合其他,有道,百度关键词 | 有道翻译 | 有道 | 有道翻译在线 | 有道词典 | 有道云笔记 | 360关键词 | 有道翻译 | 有道 | 有道翻译在线 | 有道词典 | 有道云笔记,网易旗下搜索引擎，主要提供网页、图片、热闻、视频、音乐、博客等传统搜索服务，同时推出海量词典、阅读、购物搜索等创新型产品。
64365.com,综合其他,律图,百度关键词 | 公积金贷款利率 | 年龄计算 | 企业所得税税率 | 定期存款利率 | 端午节高速 | 360关键词 | 律师 | 孳息 | 辞退员工补偿标准2023 | 诉讼费收费标准2023 | 产检假,律图（原律师365）（64365.com）创立于2004年，是全国知名的大型法律服务门户网站，自成立以来始终秉承“满足用户需求，提高用户满意度”的服务宗旨，为法律咨询者提供品质服务！旨在为广大用户寻求法律帮助指引路途，让用户找到信得过的好律师，让找好律师不再走弯路。
cnblogs.com,综合其他,博客园,百度关键词 | 博客园 | animate.css | linux 删除文件 | java nio | promise.all | 360关键词 | 博客园 | springboot | flink | elasticsearch | kafka,博客园是面向程序员的高品质IT技术学习社区，是程序员学习成长的地方。博客园致力于为程序员打造一个优秀的互联网平台，帮助程序员学好IT技术，更好地用技术改变世界。
people.com.cn,综合其他,人民网,百度关键词 | 人民网 | 人民日报 | 两个确立 | 人民日报电子版 | 党史 | 360关键词 | 人民网 | 人民日报 | 四个自信 | 人民日报电子版 | 马克思主义为什么行,人民网，是世界十大报纸之一《人民日报》建设的以新闻为主的大型网上信息发布平台，也是互联网上最大的中文和多语种新闻网站之一。作为国家重点新闻网站，人民网以新闻报道的权威性、及时性、多样性和评论性为特色，在网民中树立起了“权威媒体、大众网站”的形象。
mp.weixin.qq.com,综合其他,微信公众平台,百度关键词 | 微信公众平台 | 微信公众号 | 公众号 | 微信小程序 | 公众号平台 | 360关键词 | 微信公众平台 | 微信公众号 | 公众号 | 微信小程序 | 公众号平台,微信公众平台，给个人、企业和组织提供业务服务与用户管理能力的全新服务平台。
ssqzj.com,综合其他,3D之家,百度关键词 | 3d试机号 | 3d之家 | 福彩3d试机号 | 3d胆码 | 3d试机号今天查询 | 360关键词 | 3d之家 | 012 | www.3 | 福彩论坛 | 双色球红蓝走势图,"【3D之家-专业福彩3D门户站】免费提供福彩3d开奖结果,3d开奖号,3d走势图,福彩3d走势图带连线,3d试机号,3d试机号查询,3d开机号,3d胆码,3d杀号,3d预测,3d字谜图谜总汇,3d图库,3D彩报,3d过滤工具等资讯推荐及走势图工具分析,为还在中奖路上的彩民服务."
cn.bing.com,综合其他,必应,百度关键词 | iconfont | typescript | sas | 必应学术 | rutracker | 360关键词 | bing | 必应 | 必应搜索 | biying | 必应学术,"微软公司2009年5月29日正式宣布推出全新中文搜索品牌“必应”，打造全新的快乐搜索体验。此次“必应”中文搜索品牌的发布将于微软全球搜索品牌Bing同步，是微软全球搜索服务品牌战略发布的一个重要组成部分。
"
smzdm.com,购物网站,什么值得买,百度关键词 | 什么值得买 | 值得买 | smzdm | 摩托车报价大全 | 悠悠mp4 | 360关键词 | 什么值得买 | 值得买 | smzdm | 学而思学习机 | 鬼片,什么值得买（www.smzdm.com）是一个中立的，致力于帮助广大网友买到更有性价比网购产品的推荐网站。
bendibao.com,综合其他,本地宝,百度关键词 | 技能人才评价证书全国联网查询 | 本地宝 | 深圳本地宝 | 石家庄最新疫情 | 北京中高风险地区最新名单最新 | 360关键词 | 二维码&#160;红包 | 亲清在线 | 佛山疫情 | 烟台疫情 | 鞍山疫情,深圳本地城市生活门户网站，提供深圳地区交通、旅游、房地产、美食、购物、教育、医疗、求职招聘、团购、诚信商家等生活服务类精华实用资讯。
china.com,综合其他,中华网,百度关键词 | 中华网 | 中华军事网 | xmm | 中保研 | 传世sf怎么开 | 360关键词 | 刘伯温 | 10岁娃用牙洞修复牙膏后损失6颗牙 | 中俄这次联合空中巡航有何不同? | 翼龙贷暴力催收 | 003航母最新消息,中华网以中国的市场为核心，致力为当地用户提供流动增值服务、网上娱乐及互联网服务。本公司亦推出网上游戏，及透过其门户网站提供包罗万有的网上产品及服务。
66law.cn,综合其他,华律网,百度关键词 | 个人所得税税率表2023 | 被执行人信息查询 | 资本公积 | 职务侵占罪 | 身份证正面 | 360关键词 | 刑法 | 净资产收益率 | 土地管理法 | 工资个人所得税标准 | 保险法,华律网（66law.cn）是国内领先的在线法律咨询平台，2004年6月正式上线，隶属于成都华律网络服务有限公司。
lofter.com,综合其他,LOFTER,百度关键词 | lofter | lofter网页版 | maya | 乐乎 | 雷安 | 360关键词 | lofter | 散兵 | 老福特 | ch | 乐乎,"LOFTER是网易2011年8月下旬推出的一款轻博客，并首次采用独立域名，口号为“专注兴趣，分享创作”，将于12月1日公开注册。
"
ifeng.com,综合其他,凤凰网,百度关键词 | 凤凰网 | 凤凰 | 凤凰网官网 | 凤凰卫视 | 李念官宣三胎产子 | 360关键词 | 凤凰网 | 凤凰 | 无价之宝 | 前任4 | 凤凰网官网,凤凰网是中国领先的综合门户网站，提供含文图音视频的全方位综合新闻资讯、深度访谈、观点评论、财经产品、互动应用、分享社区等服务，同时与凤凰无线、凤凰宽频形成三屏联动，为全球主流华人提供互联网、无线通信、电视网三网融合无缝衔接的新媒体优质体验。
bing.com,综合其他,微软必应搜索,百度关键词 | bing | 必应 | iconfont | 必应搜索 | biying | 360关键词 | bing | 必应 | 必应搜索 | biying | 必应学术,微软必应搜索是国际领先的搜索引擎，为中国用户提供网页、图片、视频、词典、翻译、资讯、地图等全球信息搜索服务。
chinaz.com,综合其他,站长之家,百度关键词 | 站长工具 | 站长之家 | ping | 站长素材 | 音效 | 360关键词 | 站长工具 | 字体 | 时间戳转换 | 字体下载 | 域名查询,站长之家(中国站长站)为个人站长与企业网络提供全面的站长资讯、源代码程序下载、海量建站素材、强大的搜索优化辅助工具、网络产品设计与运营理念以及一站式网络解决方案，十年来我们一直致力为中文网站提供动力。
2345.com,综合其他,2345网址导航,百度关键词 | 2345 | 2345网址导航 | 泰剧 | 动漫网站 | 2345天气 | 360关键词 | 2345 | 电视剧免费观看电视剧大全在线观看 | 2345网址导航 | 23 | 历史天气,2345.com热门网址导航站网罗精彩实用网址，如音乐、小说、NBA、财经、购物、视频、软件及热门游戏网址大全等，提供了多种搜索引擎入口、实用查询、天气预报、个性定制等实用功能，帮助广大网友畅游网络更轻松。
sohu.com,综合其他,搜狐,百度关键词 | 向共和国的蓝天卫士致敬 | 和新老朋友双向奔赴 | 搜狐 | zlibrary | 长沙塌楼事故应急救援专家哭了 | 360关键词 | 搜狐 | 黄多多17岁穿搭 | zlibrary | 过去五年经济社会发展成绩单 | z-library,搜狐网为用户提供24小时不间断的x新闻资讯，及搜索、邮件等网络服务。内容包括全球热点事件、突发新闻、时事评论、热播影视剧、体育赛事、行业动态、生活服务信息，以及论坛、博客、微博、我的搜狐等互动空间。
blog.csdn.net,综合其他,CSDN博客,百度关键词 | base64 | element-ui | cmake | centos7 | threejs三维地图可视化 | 360关键词 | k8s | latex | rabbitmq | 网络直播服务器 | threejs三维地图可视化,"CSDN深度IT技术博客，移动开发博客,Web前端博客,企业架构博客,编程语言博客,互联网博客,数据库博客,系统运维博客,云计算博客,研发管理博客,IT blog"
sogou.com,综合其他,搜狗,百度关键词 | 搜狗输入法 | 搜狗 | 搜狗浏览器 | 搜狗输入法下载安装 | 输入法 | 360关键词 | 搜狗输入法 | 搜狗 | 搜狗浏览器 | 搜狗翻译 | 蕃尼,搜狗是搜狐公司的旗下子公司，于2004年8月3日推出，目的是增强搜狐网的搜索技能，主要经营搜狐公司的搜索业务。在搜索业务的同时，也推出搜狗输入法、免费邮箱、企业邮箱等业务。2010年8月9日搜狐与阿里巴巴宣布将分拆搜狗成立独立公司，引入战略投资，注资后的搜狗有望成为仅次于百度的中文搜索工具。
so.com,综合其他,好搜,百度关键词 | 360搜索 | 360地图 | 360搜索引擎 | 360翻译 | 潮流一族 | 360关键词 | 翻译 | 地图 | 宁安如梦 | 和平精英 游戏 | 王者荣耀 游戏,好搜是奇虎360公司推出的独立搜索品牌，致力于为您提供更精准、更快捷、更安全的搜索服务。用好搜，特顺手。
douban.com,综合其他,豆瓣,百度关键词 | 豆瓣 | 豆瓣电影 | 豆瓣读书 | 豆瓣小组 | 豆瓣官网 | 360关键词 | 豆瓣 | 豆瓣电影 | 奥本海默 | 豆瓣读书 | 掮客 电影,豆瓣提供图书、电影、音乐唱片的推荐、评论和价格比较，以及城市独特的文化生活。
sina.com.cn,综合其他,新浪网,百度关键词 | 200亿短剧生意 越土越暴利 | 男人消费力首次超过宠物狗 | 大s回应小s复出演戏 | 新浪 | 一稻济天下 肝胆两昆仑 | 360关键词 | 美元兑人民币汇率 | 新浪 | 进击的巨人最终季 | 新浪邮箱 | 买黄金的年轻人们 支棱不起来了?,新浪网为全球用户24小时提供全面及时的中文资讯，内容覆盖国内外突发新闻事件、体坛赛事、娱乐时尚、产业资讯、实用信息等，设有新闻、体育、娱乐、财经、科技、房产、汽车等30多个内容频道，同时开设博客、视频、论坛等自由互动交流空间。
weibo.com,综合其他,新浪微博,百度关键词 | 微博 | nga | 新浪微博 | 咪咕体育 | 微博网页版 | 360关键词 | 微博 | 新浪微博 | 微博网页版 | weibo | 微博热搜,微博是基于用户关系的社交媒体平台，用户可以通过PC、手机等多种移动终端接入，以文字、图片、视频等多媒体形式，实现信息的即时分享、传播互动 。
163.com,综合其他,网易,百度关键词 | 55个品牌被移出中华老字号 | 163邮箱登录 | 163 | 网易邮箱 | 光遇 游戏 | 360关键词 | 163邮箱登录 | 163 | 网易邮箱 | 网易云音乐 | 郑州一老师漏掉15名考生高考报名,网易是中国领先的互联网技术公司，为用户提供免费邮箱、游戏、搜索引擎服务，开设新闻、娱乐、体育等30多个内容频道，及博客、视频、论坛等互动交流，网聚人的力量。
qq.com,综合其他,腾讯网,百度关键词 | qq邮箱 | 微信 | qq | 和平精英 游戏 | 王者荣耀 游戏 | 360关键词 | qq邮箱 | 微信 | qq | 腾讯视频 | 微信网页版,腾讯网从2003年创立至今，已经成为集新闻信息，区域垂直生活服务、社会化媒体资讯和产品为一体的互联网媒体平台。腾讯网下设新闻、科技、财经、娱乐、体育、汽车、时尚等多个频道，充分满足用户对不同类型资讯的需求。同时专注不同领域内容，打造精品栏目，并顺应技术发展趋势，推出网络直播等创新形式，改变了用
vodjk.com,医疗健康,健康第一线,百度关键词 | 泰国试管婴儿医院 | 人死前的15种征兆 | 望闻问切指的是什么 | 泰国试管婴儿机构 | 泰国试管医院 | 360关键词 | 姐夫 | 杨梅的功效和作用 | 双相障碍是什么病 | 小腹疼 | 肺结核的传播途径,健康第一线（www.vodjk.com），首家健康类视频网站。提供权威，公正，科学的专业健康视频信息，内容涵盖老百姓关心的诸多健康话题。
www.baidu.com,综合其他,百度,百度关键词 | 炎亚纶涉嫌性剥削被起诉 | 为中美关系把舵领航 | 女生没开朋友圈被hr质疑性格封闭 | 中国女子在日本遇害案监控曝光 | 济南15岁少年被清华录取 | 360关键词 | 百度 | baidu | www.baidu.com | baidu.com | 百度一下 你就知道,百度，全球大的中文搜索引擎、大的中文网站。2000年1月创立于北京中关村。
myzx.cn,医疗健康,名医在线,百度关键词 | 减肥食谱一周瘦10斤 | 名医在线 | 袋鼠妈妈护肤品安全吗 | 315曝光不合格益生菌 | 7周香港验血男孩却生了女孩 | 360关键词 | 阿尔兹海默症 | 地中海饮食 | 他达拉非的功能主治 | 肺部磨玻璃结节意味着什么 | 不明肝炎最新发现,"名医在线(myzx.cn)是一家专注于健康咨询,健康问答的专业医患互动在线平台.提供专业的免费网上看病,在线问医生,医生在线咨询,解答等服务...健康问题,一网答尽!"
3618med.com,行业企业,3618医疗器械网,百度关键词 | 3618医疗器械网 | 郑州大鲸医疗科技有限公司 | 全自动仿生助产仪 | 愈合基台 | 北京新科以仁科技发展有限公司 | 360关键词 | 3618 | 贝科 | 医疗器械新闻 | 手术录播系统 | 3618医疗器械网,锐进3618医疗器械网（www.3618med.com）含各种医疗器械产品，3618特色频道有：医疗器械代理招商、招标中标、企业名录、新产品视频。
mingyihui.net,医疗健康,名医汇,百度关键词 | 武汉总医院 | 西安白癜风专科医院 | 乐平市第二人民医院 | 浙二医院挂号网上预约 | 广州包茎恒健标杆 | 360关键词 | 306 | 名医汇 | 郑州妇科 | 潘奇 | 上海最好的妇科医院,名医汇是全国覆盖面广的网上预约挂号平台、提供网上挂号、手术直约、电话/在线咨询、图文问诊等就医服务。3300家公立医院67万医生录入独家医院排行榜，200万病人点评医院、医生助您找到适合的就医方案快速挂号；
zysj.com.cn,医疗健康,中医世家,百度关键词 | 中医世家 | 奎宁 | 中医内科学 | 医学衷中参西录 | 黄帝内经素问 | 360关键词 | 伤寒杂病论 | 远志 | 中医世家 | 秦艽 | 皇甫谧,中医世家（王氏）的记录；中医相关的理论、方剂、药材、医案等信息的收集发布。
chinacdc.cn,医疗健康,中国疾病预防控制中心,百度关键词 | 中国疾病预防控制中心 | 中国疾控中心 | 疾控中心 | 国家疾控局 | 中疾控 | 360关键词 | cdc | 中国疾病预防控制中心 | 中国疾控中心 | 疾控中心 | 防疫,中国疾病预防控制中心(以下简称中国疾控中心)，英文名Chinese Center For Disease Control And Prevention，缩写CDC。是由政府举办的实施国家级疾病预防控制与公共卫生技术管理和服务的公益事业单位。
bioon.com,医疗健康,生物谷,百度关键词 | 生物谷网站 | mnsod | 生物谷 | rorγt | 生物谷网站 | 360关键词 | mrna | 生物谷 | diagonal | 圣诞岛虎头鼠 | 刺突蛋白,生物谷（www.bioon.com），中国专业的生物医药学网站，提供生物医药领域的资讯信息，以及与生物产业，新药开发，生物医药行业报告，生物医药人才招聘等综合服务
yaozh.com,医疗健康,药智网,百度关键词 | 药智网 | 药智数据 | 药智数据库 | 药智 | 药智网数据库 | 360关键词 | 药智网 | 药智数据 | 药智数据库 | 药智 | 药智网数据库,药智网是中国健康产业大数据服务平台，提供医药相关的所有数据信息，并汇聚数十万医药人才为您解决药品研发、生产、销售、技术转让等各个环节所遇到的难题！
medsci.cn,医疗健康,MedSci-临床研究与学术平台,百度关键词 | 梅斯医学 | medsci | sci影响因子 | medsci影响因子查询 | 梅斯医学影响因子查询 | 360关键词 | 梅斯医学 | 国家自然科学基金查询 | medsci | sci影响因子查询 | 梅斯,MedSci(梅斯医学)是专业从事临床研究、临床研究设计、数据管理、医学统计、学术论著翻译、修改的高端学术服务机构，致力于医疗质量的提高。
guahao.com,医疗健康,挂号网,百度关键词 | 微医挂号网 | 九龙男子医院 | www.guahao.com | 预约挂号网 | 上海医院预约 | 360关键词 | 微医 | 挂号网 | 挂号 | 南京皮肤病研究所 | 上海市浦东医院,挂号网是卫生部批准的全国健康咨询及就医指导平台官方网站，聚合了全国3900余家医院，600家重点三级以上医院的预约挂号资源，帮助每个患者，找对医生挂到号！
biomart.cn,医疗健康,丁香通,百度关键词 | 丁香通 | 巴氏小体 | star478 | f4/80 | idata知网免费入口 | 360关键词 | snp | 丁香通 | 吲哚乙酸 | ngs | 艾本德,丁香通，丁香园旗下专业的生物医药商业信息平台，拥有试剂抗体、仪器耗材、医疗设备、辅料原料药等各类产品供求信息近300万条，致力为医药企业和生物医药相关行业人士建立联系的桥梁和纽带，提供购销渠道以及优质服务，满足会员供应采购、合作转让招商代理、信息资讯查询等各类营销及实验科研需求。
cnkang.com,医疗健康,中华康网,百度关键词 | 美女大战精子 | 上海癫痫病医院 | 美女vs精子 | 牛心菜 | 癫痫病军海医院 | 360关键词 | 华东疗养院 | 朱世杰 | s是什么意思 | 不举是什么意思 | 上海皮肤科医院排名,中华康网致力于打造权威、全面、专业的健康资讯门户，全心全意为网友提供健康服务。如果您感到身体不适，或者想了解生活健康疾病相关的信息，在这里您可以找到答案。如果您觉得本站还不错，记得要和朋友一起分享哦！
dxy.cn,医疗健康,丁香园,百度关键词 | 丁香园 | 丁香园医学论坛 | 丁香园用药助手 | 丁香园论坛 | 丁香园医学网站 | 360关键词 | 丁香园 | ind | 丁香园医学论坛 | aki | 用药助手,丁香园是面向医生、医疗机构、医药从业者以及生命科学领域人士的专业性社会化网络，提供医学、医疗、药学、生命科学等相关领域的交流平台、专业知识、最新科研进展以及技术服务。
familydoctor.com.cn,医疗健康,家庭医生在线,百度关键词 | 家庭医生在线 | 昆明白癜风 | 合肥治疗性病医院 | 甘肃白癜风医院 | 如何自罚必须非常疼又无声 | 360关键词 | 过敏性鼻炎怎么治最有效的方法 | 502胶水粘在手上怎么去除掉 | 家庭医生 | 肠炎的主要症状有哪些 | 耳鸣治疗费用一般多少,"家庭医生在线是国内健康传媒品牌《家庭医生》杂志品牌在新媒体上的传承新生。家庭医生在线紧密围绕新媒体内容制造商、提供商和健康需求人群服务商的定位开展业务。家庭医生在线拥有以12位院士、国医大师为首的百余位医学权威组成的专家顾问团，拥有由400余位三甲医院副高以上一线临床专家组成的医学委员会。

"
pingguolv.com,医疗健康,苹果绿养生网,百度关键词 | 金枪鱼 | 捕捉儿童敏感期 | 侧柏叶洗头 | 喝水不让尿还按压小腹 | 顶着孕肚做 | 360关键词 | 淫羊藿 | 茉莉花 | 甘蔗 | 石斛的功效与作用 | 海棠果,苹果绿养生网与多地养生协会签订深度合作关系，以让生活更健康为宗旨，专注于天然养生保健知识，从营养学、中医学、健康管理学、美容学、心理学、运动学等不同维度分享养生之道和生活保健常识，是国内专业的养生保健网络媒体。宗旨：普及天然养生，提高生命质量，爱惜公共医疗预算，缓解医疗资源紧张。
91huayi.com,医疗健康,华医网,百度关键词 | 华医网 | 华医网继续教育网入口 | 科教管理平台 | 华医网继续教育 | 菏泽继续教育管理平台 | 360关键词 | 华医网 | 华医网继续教育网入口 | 掌上华医 | 医师定期考核 | 华医网继续教育,华医网专注于为中国医疗卫生行业提供远程教育培训和信息技术服务，已通过卫生部互联网卫生信息服 务管理审核，是卫生部批准的远程继续医学教育试点单位，是北京市科委认定的“双软”企业和高新技 术企业。
cnys.com,医疗健康,中华养生网,百度关键词 | 急性败血症 | 上皮细胞2 | 植脂末是什么 | 吃螃蟹喝什么酒 | 艾滋病标志 | 360关键词 | 肌酸激酶高是怎么回事 | 燕窝的功效与作用及营养 | 菠萝蜜的功效与作用的营养 | 橙子是热性还是凉性 | 养生知识,中华养生网是知名的养生门户，为广大网民提供养生保健知识，包括中医养生，食疗养生，运动养生，健康养生方法，春夏秋冬四季养生小常识等内容，是您健康生活的好伴侣！
jiankang.com,医疗健康,百姓健康网,百度关键词 | 开初处苞 | 卡斯琳抗敏褪红 | 女性的b | 女生扒开尿口 | 男生操男生 | 360关键词 | 人参果的功效与作用 | 甲状腺的主要症状 | dha的作用与功效 | 转氨酶 | 37度算发烧么,"百姓健康网(jiankang.com)作为权威医疗门户网站,提供前沿,完善的医疗资讯,依靠权威医院专家,院士合作,提供医院专家预约挂号,就诊信息,医患问答平台,提供权威健康服务,关注百姓健康"
cn-healthcare.com,医疗健康,健康界,百度关键词 | 吴孟超 | 乡镇卫生院 | 升白 | 可穿戴动态血压 | 坚决打赢疫情防控的 | 360关键词 | 健康界 | 生活饮用水卫生标准 | 医院排名 | 心电图怎么看图解 | 人体肌肉图,健康界网站是中国医疗界权威门户，拥有网站、手机报、移动客户端、微信、微博、图书等全媒体产品，关注医疗政策、医疗改革、医院管理、临床前沿、健康管理、医疗产业、医疗传媒等内容，目标受众包括卫生管理者、医院管理者、医务人员等。
fh21.com.cn,医疗健康,飞华健康网,百度关键词 | 爱他美奶粉怎么样 | 馒头穴 | 飞华健康网 | 雀巢奶粉怎么样 | 黑龙江中亚癫痫病医院口碑 | 360关键词 | 接吻病 | 整形 | 精神病医院 | 肺癌药物 | 美国疫苗,"飞华健康网是中国具有影响力健康门户，根植大众健康，提供科学权威的健康资讯，从医疗健康,保健到母婴育儿、两性健康等内容.并联合知名机构自主研发健康类软件，凭借丰富的医疗资讯和专业的技术为网民提供健康、营养、医疗等健康信息和服务"
ilife.cn,医疗健康,中国美容美体网,百度关键词 | 中国美容美体网 | 屈臣氏燕窝面膜 | 素颜霜妃龄七白膏 | bnt | 居家观察和居家隔离区别 | 360关键词 | 司美格鲁肽功效和作用 | 司美格鲁肽注射减肥有副作用吗 | healthy care | 玉米胚芽粉 | 颜如玉口服液怎么样,"中国美容美体网-是国内高端的美容美体保健品产品综合商城,销售各种美容美体保健品,包括:美容护肤,美体瘦身,丰胸美乳,香水彩妆,保健养生用品等,开通全国三千多个城市货到付款服务, 让您购物零风险"
xywy.com,医疗健康,寻医问药,百度关键词 | 寻医问药 | 悍马糖 | 寻医问药网 | 玉房秘诀 | 蒙古褶 | 360关键词 | 正常心率值是多少范围 | 寻医问药 | 红房子 | ocd | 上呼吸道感染吃什么药,寻医问药网以“为全民健康导航”为己任，传播“品质生活、健康为先”的理念，为患者、医生搭建精准医疗信息查询，一对一在线咨询，预约挂号等服务平台。
